"User","Location","Date of Review","Review Title","Review"
"ingmar b","Davao City, Philippines","April 27, 2015","The top part of the falls is the best","the top part of the falls is the best. There is almost no people over there. it is more a nature experience over there. down the falls it is more concreted and more busy. there are also ATV's for rent and for people that want to go to the highland this is a good starting point."
"Lim P","Makati","April 19, 2015","Not A Waterfall at all!","This place is touted as a waterfall but to me it is not a waterfall. I have seen better waterfull in other parts of the world. There are so many people swimming there and the water so dirty. You have to climeb a rather steep stairs to get to the top and make your way down. . water pring"
"niquedejesus","Manila, Philippines","April 10, 2015","Refreshing and amazing","Entrance fee: Php 40 per head Table with umbrella rental: Php 150  It is located inside the Hagimit Nature Park where several resorts/area owners can be found. There are cottage rooms for overnight stay too. Our tricycle driver brought us to this part of the park where you need to pay Php 150 to use their table. We weren't supposed to rent one, but I found the area so pleasing for lunch so we decided to buy lunch and eat there, by the falls. So refreshing. The owner was so kind and asked our driver to buy lunch for us. He said he can get Sugba (grilled fish), it's just perfect! I gave him P300. He came back with 2 big pieces of RAW bangus (milkfish) and some tomatoes, onions, calamansi, chilies and uncooked rice. I was shocked as I thought I was already waiting for a cooked lunch. The owner offered to grill it for us though, no charge.  While waiting for lunch, we swam in the refreshing river. The other owner offered to take photos of us, lots of photos. When lunch was served, we devoured it like crazy! Sans the utensils. It was a lunch serving big enough for four to five people for only Php 300. How fun! It was one of the best lunch of my life!  Check out the full itinerary of our Samal trip at http://www.moniquedejesus.com/2015/04/samal-island-davao-in-three-days.html"
"Roseann G","Calamba, Laguna, Philippines","March 19, 2015","Be sure to bring your swim suits! ","As much as we wanted to take a dip, we lacked time. Instead, we just toured around, take pictures and yes, we did have fun. Its a bit tiring specially going back to the parking area. Its an uphill challenge for us. It is nature at its finest. Two thumbs up for this place, its a must visit. "
"Jim B","Davao City, Philippines","March 11, 2015","Nature at its finest","While visiting Samal Island, my fiancé and I decided to visit Hagimit Falls. Let me tell you, if you love nature, beauty, refreshing water, a photographer's heaven, then you will love Hagimit Falls. For a small fee, p40, you can enter this beautiful paradise. We spent several hours photographing the beautiful scenery, swimming in the pools, and walking around. I would definitely recommend this attraction to anyone visiting Samal Island. But rather then pay a resort's fee of up to p3,000 you can catch a tricycle to and back for about p400. Spend the day swimming and soaking up nature at its finest."
"grace175","Davao del Norte Province, Philippines","March 10, 2015","GOOD HIDE OUT","From a demanding city to a nonviolent place in hagimit.. just very relaxing, stresses are gone.. expenditures are affordable!! ^_^ ..such a wonderful treasures in Davao. =))"
"joy t","Cebu City, Philippines","March 2, 2015","good for a change","we brought roast chicken and ate it there...we spend half of the day just swimming and head back to the resort.. we enjoy it and we like the place"
"yasameen_desu","Manila, Philippines","February 23, 2015","Great for nature lovers!","We dropped by Hagimit Falls on our way from Kaputian Beach to Camudmud. Our habal driver suggested for us to visit the place and we figured it wouldn't hurt to have a quick look. We were not expecting anything and quite honestly we just wanted to be in a cool place after a long and hot drive. Upon arriving, we were told that a 40php fee for entrance is required per person for a day tour and if we wanted to get a cottage, there would be a separate fee for it. We told the lady at the entrance counter that we'll just have a quick look.  There is a comfort room for no fee inside the premises. If you are not that physically active, walking down and up the cemented staircase might be exhausting. But if you're a mountain climber and runner, going to the falls is like a walk in the park.  I've seen some falls before so my friend and I were expecting just one Falls spot but Hagimit is like a series of different falls. There are several spots and cottages around the area. It would have been great if we were able to stay for a quick swim. The place is really cool, water is cold and refreshing. Definitely worth the 10-15 minutes side trip from the main road/highway!"
"ljdinbelize","San Pedro, Belize","February 19, 2015","Beaufiful scenery","Great sight to see, lots of stairs but well worth the walk. Take bathing suit as you may wish to swim."
"Aimorosa","Manila, Philippines","February 18, 2015","Relaxing stop after a hike","this is a good spot to have a breather in the island.. as you approach the area you can hear the inviting flowing water from the falls. the view is spectacular, the water is so relaxing. we did a trail run at the island and this is one of the stops we made.  it's worth it!"
"daveg7964","Haverhill, United Kingdom","February 12, 2015","Travel from paradise resort by motorcycle","Staying at paradise or other resorts, you can take motorcycle or car to the waterfalls take a picnic with you the water was clear and very refreshing (cold) although best to avoid after rain as water is very muddy, lots of locals there nice to mingle its free but if you take car/jeep then you need to pay a small fee"
"PrincessVictoriaK","Raleigh, North Carolina","February 4, 2015","It's just an average place to bond with family.","If you are like me who wants to visit different places, better include this with your adventure. We go there cause my mother knows one of the owner and we like to relax away from the city."
"KlausDORING","Davao City","January 31, 2015","I expected more","Going there with habal habal is too expensive. And: rough road. Falls are good looking - a kinda romantic atmosphere. Everything just average."
"MijnlieverdFH","Amsterdam","January 13, 2015","Road to the place is bumpy.","The falls is not as high as we thought about waterfalls.   Yet there were a lot of similar low waterfalls scattered within the area. To go down the place took us less time; but was thinking how could it be in going back. It was a high steep staircase, and so one has to make stops i getting back up to the parking area."
"Mary Ann F","San Juan, Philippines","January 1, 2015","Rocky Road","Going to Hagimit falls is not worth to try. The habal habal charge is expensive and nothing special to see in this place. Rough road all the way from Pearl Farm to Hagimit Falls"
"Venus66_08","Valencia City, Philippines","January 1, 2015","Not as expected","I found the place truly wonderful and amazing but it was not what I expect because the water was not clear maybe because of the rain, so disappointing to see a color brown water but the falls is so good looking."
"Jong V","Lauderdale Lakes, Florida, United States","October 7, 2014","love of nature","its a little bit remote place but very nice, Dislike- there was no signage on the enter section showing the location of the falls."
"TravelBug1469","Manila, Philippines","September 22, 2014","Nature Adventure","Far from the likes of great waterfalls but a good nature adventure no less. Made up of many small falls one after another - cascading down rocks, boulders, and natural terrain along a river - Hagimit is ideal for swimming with its cold, refreshing, and not so deep water. There's lot of fun walking above and hopping between rock formations. Foot bridges are available in some areas. There are cottages and umbrella for guests but no decent food available. Confusing was the rate because except for entrance fee, numerous 'rights' claimants of land along the river bank collect 'fees' each time you hop from one place to another. Better plan your trip; bring anything you need and stay where it is most convenient to you. Unfortunately for us, we never had the chance to swim; the water was highly silted when we went there because of heavy downpour the night before. Take a motorcycle (habal-habal) from the resort (where you stay) anywhere in Samal Island and tell driver to bring you to Hagimit. Make sure to arrange for two-way ride since the place is remote and no regular transport going there. From Davao City - with own vehicle - head southeast on Davao-Bukidnon Road (Pan Philippine Highway) towards De Lara Street then turn left onto Mac Arthur Highway all the way onto Buhangin Underpass then turn right towards Davao-Panabo City Road until you reach the ferry terminal going to Samal Island. After disembarking off the ferry, drive straight from the port then turn left towards Babak-Samal-Kaputian Road, Take the first right along Babak-Samal-Kaputian Road then turn left going to Hagimit."
"hopper28","Cagayan de Oro, Cagayan de Oro, Philippines","September 3, 2014","small but amazing","upon reaching the entrance of the falls, one would say ""is this all?"". following the 500m trail, however, and then finally reaching the series of falls, one would be truly amazed by how the true nature of the falls were. i mean, there were no major renovations done by the resort owners that I truly appreciate that they did not do something to the nature.  the little falls are an enjoyable scenery & once you hop into the water, one would not worry to drown because its like 4-5ft water level (except of course for water level near the fall-its around 7ft they say)"
"nike0608","Cagayan de Oro, Philippines","August 23, 2014","Ok","I was not really a fan of the place. I think due to the storms that hit before our trip there, the falls is not as good as it used to be. However, it was a great way to bask in the cold water after touring the whole island under the heat of the sun. Refreshing but I expected better. "
"rubberunethical","Dubai","August 10, 2014","Tho we paid both lower & higher entrance fees, caretaker hostility","When we tried to exit the campers' only route after a quick tour. Pretty place but crowded and unfriendly this time."
"MelP160","Davao City, Philippines","July 7, 2014","Go early and avoid the crowds","We went at 8 am to this popular attraction to beat the crowd. We found a nice spot and just lay down on the rocks. Bliss- feeling the water wash over our bodies."
"Wam R"," ","July 2, 2014","Try jumping off the cliff and down the falls!","It had been an wonderful experience! Try jumping off from the top of the falls down like what my friends and I did, and I'm sure you'll enjoy it here. The only thing that made me not rate this as excellent is the long walk (upwards) that we had to make to get there. But over all it was awesome!"
"Christine D","Makati, Philippines","July 1, 2014","Could be better","The water falls are unique and have their beauty. I just wish the diversity of the place is better preserved to be appreciated more by humans. We came there at the peek of the holiday, hence there were a lot of people in the area. A lot of rules were not being followed by the locals like ""no diving"" but a lot of diving were made by the locals. Well can't expect much for a Php20 entrance fee. Saw a water lizard speeding off on top of the ""quieter"" side of the falls."
"Richard C"," ","June 17, 2014","Useless water falls","Went to visit this ""water falls"", paid 40 pesos for each person to enter. It is a self guided tour yourself type. Why pay if no one cares to tell you where to go. There are signs if that is fine with you. There was a restroom but padlocked. Why even bother putting a restroom if your not going to let anyone use it. Terrible place... surely a waste of time and money. You better go somewhere else usefull."
"wyn0nna","Cebu City, Philippines","May 8, 2014","perfect for hot summer","never a fan of falls until i've seen the place. i don't know how to swim so i have to consider its depth. good thing there are places there where we can enjoy"
"DON9260","General Santos, Philippines","March 15, 2014","Samal trip","the place is cool and beautiful... me and my friends really enjoyed the place... we really had fun and wish to be back here again..."
"summer q","Manila, Philippines","March 15, 2014","So serene!","i stayed long in this place though it was just a day tour.but it's really great.i took a lot of pictures and did some crazy activities there.this is a must-see place."
"TangAdrao","Davao City, Philippines","February 21, 2014","Worth Weekend Getaway","HAgimit Falls is located in Penaplata, Samal Island. Like any other local nature attraction, it doesn't have much to offer other than its little falls with its layered natural basins that always make everyone captivated. It is surrounded with dense trees making the experience more like in the middle of a jungle. It's difinitely a one worth destination for family or for anyone searching for a place to be one with nature. One can actually trekk up and find tree house with breathtaking views of the forest. It has some cheap cottages and the entrance fee is just cheap as well.  Bring your own food when planning to spend your lunch or dinner there. The place is quite far from panaplata market so it's more hassle free if you bring food before going there."
"AGV_1419","Mandaluyong, Philippines","January 28, 2014","Waterfalls bringing you closer to nature.","From 40php/person we were given a 50% discount because the river was a lil murky as it rained two nights before.The trail leading down to the waterfalls is about 3-5 minutes walk, so bringing a lot of stuff with you is not really ideal. From the end of the trail you could already see one of the many small waterfalls. There are bamboos and full-grown trees, so you'd feel more closer to nature. :) It separates/split into two as water flows downstream. It's like a ladder of waterfalls of different heights (approx 2 ft to 7 ft) creating natural swimming pools (4ft to 7ft according to the caretaker). There are open cottage and close huts/rooms for rent. If your looking for a side trip or day-tour or picnic venue, I recommend this place. Think twice though if you are planning to bring your young children with you or those who have problems with their knees/knee joints.  *From Davao City ride the City Island Tour Bus going to Samal Island/Kaputian, ask the conductor to drop you off in Penaplata. From Penaplata, ride a habal-habal 20php, one-way, per person."
"Dee G","Davao City, Davao City, Philippines","September 26, 2013","Used to be so Beautiful","We used to go to Hagimit Falls with friends some 9 years ago. It used to be so beautiful. The beauty of the place was not with the falls, but with how secluded it was. There was no entrance fee, no cottages and no stores. The road was not developed too, but again, it was these that made the whole experience fun.  Now, they turned the falls into some sort of resort. Guests have to rent cottages and there's an entrance fee. On weekends, there's a lot of people so expect noise and (maybe) chaos.   If you want to spend the day relaxing, head to a beach instead. I suggest Talicud Island where Leticia by the Sea is. The resort's to die for - excellent for both body and mind.   Here's a helpful article about Talicud Island - http://tropicalvacationspotsblog.com/why-talicud-island-at-davao-city-is-worth-a-trip/"
"My26"," ","September 14, 2013","Blue water","usually the water is not clear if it rained a night before. If you plan to eat your lunch, bring everything from food to plates because they dont have restaurant inside. Many tables, open and close cottages for rent. Water is refreshing, sometimes very cold.  I like the area of Mahal because they make their place like swimming pool type, safe for kids. Ofcourse you still need to watch them very good because sometimes theres a strong current. Also nice concrete pathways (stairs), much easier.  Compared from year 2008 which is natural and not crowded, the place now is full of cottages and entrance fee cost 40/adult, 20/kid.  ATV ride is also available for rent, except when we visit during weekdays."
"Shei928","Manila, Philippines","September 11, 2013","Muddy water..","We were there in the morning but the night before the trip it rained so the water is not clear. Instead of Php 40 they asked for Php 20 because of the color of water. Falls is not that high so don't expect too much. The place is also not convenient to go to especially in habal habal. "
"Dean C","Baguio, Baguio, Philippines","September 10, 2013","Hagimit Falls, Samal Island: Photo Review","It was great visiting Hagimit Falls and Nature Park which was a 10 minute ride after the view point area. Here we had to pay P40/each entrance fee. We felt that everything should be paid in Samal, nothing is free. But since we were already there, we went in and saw the beautiful natural swimming pool created by Hagimit Falls. The water was cold but refreshing. We took a dip and enjoyed the flowing water. Again, we had to pay for cottage fee which is I think was P150 regardless how short our stay was.   More photos and videos of Hagimit Falls are found at : http://watwatworld.com/2013/09/10/discover-island-garden-city-of-samal-a-travel-guide-and-adventure/"
"xChaLeex","Quezon City, Philippines","September 6, 2013","Great but worried about the future of this place","This has been one of the best falls I've ever been. Compared to others, it doesn't have the mother falls of altitude nearby but it has lots of place where you could cool down. The flow of water stretches down to at least 10 pools of water. With cottages all over the place, and ATV adventure for rent, I am a bit worried that this place will lose its beauty in the future if not preserved properly. It is always crowded and therefore nature is abused, I would want this place to be untouched like those of Siquijor and Baler."
"Cqdt"," ","August 9, 2013","Great place for the family","I went to hagimit falls with my family due to curiosity mostly. Entrance fee is relatively cheap and the water was clear and very cold. It's a great place for the family to bond/ talk since there's no loud music or reception. The only thing that bothered me was the maintainance of the toilets and changing rooms. They were horrible. The management should do something about it.  The stairs leading to the falls can be quite challenging to very old people. I'd discourage you to bring them along especially that there are no existing facilities for the less abled.  Overall, I still enjoyed seeing this attraction. It's a nice way to spend an afternoon with the family."
"PDD-101","Davao","July 3, 2013","tut tut what a bad way to treat nature","Took a trip to Hagimit falls and was somewhat dismayed at what I encountered The entrance fee is 20 peso for adults and 20 for kids and then they sting you for another 20 for car parking. As there is no other way to get there apart from your own car (unless you want to hire a local motorcycle taxi) then it is a sting to get a extra charge for parking.  The steps down are steep and the steps have been cut uneven and at different heights and lengths so making the walk more difficult - at the entrance to will start to see the multitude of signs put op to tell you what you can not do  There are no signs to direct you to what you can do or where to go. You end up wondering around the winding badly laid and very very ugly concrete paths that looks like a bunch of kids threw down one sunday afternoon with no planning or supervision.  There is no where to get changed if you want a swim and I saw 2 people having a full wash soap and shampoo in the pools  There is no easy entrance to the water, there was no thought given to how people would get in or out of the pools.  If you stand next to one of the very small and badly constructed open huts for a few second you will feel the air pressure change as people rush to demand 250 peso from you. But look around for help and information and its a ghost town  The ""falls"" them selves are just a few meters high and the pools are full of sharp unseen boulders and stones  As more and more Locals get to travel and see other tourist attractions in other countries they will come back and realise how badly their own natural attraction are being used and abused  A definite thumbs down from me. A drunk blind man could have planned this ""attraction"" better      ."
"MissKellyG","Manila, Philippines","June 15, 2013","Refreshing","For someone who doesn't walk to far places often, I had a harder time climbing down the steps towards the pools of water and back up. But it was worth it when I saw how clean the waters were. It was a refreshing dip."
"SupahEileen","Manila, Philippines","April 27, 2013","For the oldies, they say it's a goodie","My mom and stepdad went here for my mom's birthday celebration in March. She was pretty happy but my stepdad expected more (he's gone to bigger falls like iguazu, niagara and the one in croatia - forgot the name - so excuse him) we were happy that he made it to the bottom of the stairs. they had their lunch there and my mom went into the water.  it's not as cold as she thought.  i have a more in depth review of the place on my blog. it's here http://thesupertourists.com/exploring-davao-and-samal-nature-trips-for-the-seniors/"
"Robertvon","Nashville, Tennessee","April 7, 2013","OK","The locals seemed to like it but I was used to the waterfalls of Odda, Norway last year so these were tiny compared to Norway."
"6452","Davao City, Philippines","March 28, 2013","Hagimit Falls..hidden no more.","My two elder kids had already visited Hagimit Falls in Samal Island more than 3 years ago, unexploited in the midst of a virgin forest I saw their pictures taken in Hagimit Falls. It was inviting. I wanted to go to Hagimit then but my kids warned me that it is difficult to get there as trail is not yet develop especially for our age. There was no entrance fee then. Until lately I heard that going there is a lot better now as public transportation is already available and concrete stairs are built for easier trail.  Hagimit is in Samal Island, about 2 kilometers from Penaplata Public market. Signage is visible along the national road. P5.00 per person is collected by the local people for environmental fee, My 11 year old daughter is free, but not for the entrance fee which is P40.00 per person. We walked down the cemented stairs for about 15 to 20 minutes to the falls. We had to carry all our stuffs with us, food, bags, water etc. as it would be tiring to get back to the parking area if we left something we need. Hagimit Falls is just a small waterfall that has natural swimming pools. It is hidden by full grown trees and natural vegetation from the hot rays of the sun. I didn’t sun block then. Water is very cold and refreshing. Although Samal Island has a lot of nice and developed beach resorts with white sand and clear and clean waters, Hagimit Falls is a nice destination to visit. It may not be as beautiful and developed but it is still a nice getaway. There is one thing I regret not doing while in Hagimit. I stayed in just one or two waterfalls. I thought that was all. That was disappointing to me because I learned there were still a lot of falls I haven’t seen had I only took time to walk a hundred meters more from the main bathing area. Three of my companions told us they went as far as 150meters more and saw two more wonderful falls. But that was late announcement as we were already on our way back to our van. Maybe for the next visitors, they should try to go a little farther to check. Open cottages are rented for P300.00. Grilling stations and wash areas are available. I don’t like the idea of them charging the public for P5 to P10 comfort room usage. I doubt children would do it somewhere or worst, in the waters just to do away with the fees. I hope this concern would be given attention by the people maintaining the resort."
"466Neo","Davao City, Philippines","March 17, 2013","Very nice place","Its well worth visiting very pretty place, but be warned its very slippery there, and a lot is getting bad accidents so did we"
"Storyseamstress","Philippines","March 11, 2013","Eco-friendly management needed asap","A long trek downhill to these multilevel falls should be worthwhile, but the encroachment of people and their has begun to spoil the natural beauty of the place. Some guests have vandalized the rock formations, making one wonder if anyone cares to keep the place pristine at all. Better management is urgently needed, and the unsightly overnight cottages, unnatural barriers, and other needless concrete structures should be dismantled immediately. "
"New_YLOO","Philippines","February 4, 2013","Hagimit is NOT in Apo island","Not sure why Hagimit is showing here - Hagimit falls is in Samal garden island - off Davao. I have been there - and it is quiet beautiful."
"Andy B","Iloilo City, Philippines","January 19, 2013","Falls everywhere","I was surprised when i went to hagimit falls and saw not just one but actually a lot of falls..it was falls everywhere. very nice place, affordable and very enjoyable place to be with family or friends. very nice experience and area is pretty accessible...More"
