"User","Location","Date of Review","Review Title","Review"
"lizl0ves2travel","Manila, Philippines","October 26, 2012","Wonderful Place to Chill","I loved it! Much more easy to access than other big falls. It has many mini-falls and you can choose your own spot. It was early in the morning when we went there so it wasn't crowded. I was like a happy kid playing and...More"
"JoyfulSoLe","Makati","August 25, 2012","A refreshing retreat","It's a relaxing and soothing atmosphere. The falls are easy to reach as compared to other off the beaten path like the grand Aliwagwag Falls. It can be a quick escape from the scorching heat of the sun. The good thing about the place is...More"
"Pieter-Jan V","Samal, Davao, Philippines","August 10, 2012","Nice blue water","Many deffirent falls with many small poolswhere you can swim. Try to go on a day with no rain the day before because the rain bring mud from the mountain and the water can be brown"
"Todd B","Las Pinas City, Philippines","July 13, 2012","Hagimit Falls: Worth the trip","This was a lovely spot to while away an afternoon. The water in several of the man-made pool areas was extremely chilly, though. I cramped up after about 10 minutes of swimming and had to get out to warm back up. There are vendors in...More"
"wendell v","Mandaluyong, Philippines","July 12, 2012","A True Gift of Nature","This is probably just me (us) but Hagimit falls gave me (us) genuine relaxation. Just the sight and sound of the waterfalls can already give you a sense of serenity and being one with nature. I love the way how the water massaged my whole...More"
"HALLYCS","Quezon City","June 29, 2012","Good Massage","We went here June so no crowd of people. Stayed here for a couple of hours. There's nothing much to do but to drown yourself in the falls. Water is good. Put yourself under the flowing water for a good massage."
"Macben_1969","San Fernando La Union, Philippines","May 6, 2012","Nice place","For a minimal entrance fee, you can enjoy bathing in the cool waters of this beautiful mini-falls. The water looks clean but not clear. There are rentable tables and huts in the vicinity that makes the place look untidy and disorganized. The trek to the...More"
"rpacute","Davao City, Philippines","May 5, 2012","Natures beauty ruined by development","The falls is beautiful. However, it is ruined by unplanned/ unsupervised development. The resort at the lower end is in much better condition than the one near the source."
"Pierre C","Cebu City, Philippines","April 26, 2012","If you are lucky","The site itself is very nice but it has been overdeveloped and if it is crowdy the day you will visit it, you may not appreciate it the way you should. We were there in summer time and of course, it was crowdy. People everywhere. If you are there with your family, you will be able to take the most of it and your children will really enjoy jumping into the river or sliding on a rock. If you just want to relax, arrive there very soon. Later, it will be too late."
"lily p","Makati, Philippines","February 3, 2012","hagimit","-Good place to have a back massage, just choose which falls you'd like.  -If you are not gonna get a cottage, you are not allowed to put your things just anywhere. You can only put them on the grass or on the soil. That was what we were told by a boy who kept asking us if we were gonna get tables or cottages. -I did not understand why they have to have 2 resorts in the area. The whole place seemed a little bit unorganized and messy because of this. Nevertheless we enjoyed our visit there, the water was refreshing plus we had free back massage from the falls!"
"OWSI","Luzon, Philippines","January 28, 2012","It could be better","its a beautiful natural feature ruined by development."
"tinamiranda","Manila, Philippines","January 18, 2012","Nature did it all, man just keeps destroying it","On our way to the falls we passed by many signs that said Hagimit Falls – printed on the signs was the face of salon owner Jessie Mendez. Apparently, he owns a part of the resort.  Hagimit Falls is a series of water falls with varying degree of sizes. The whole resort is divided into portions. Some parts are well-maintained while the others are just plain unattractive.  There are some cottages scattered in the area and prices start at ₱50 . Guests at the resort may bring in food and can swim in the area. The time we went there, the water was not clear due to the heavy rains brought by typhoon Sendong. You can see pictures of Hagimit Falls at my blog www.shootwritepost.blogspot.com"
"Rexoy","Davao","January 11, 2012","Great Massage","The falls made for a great hydro massage after exploring Samal for the day. However, it is not for the physically challenged, the distance from the parking area to the falls was a bit considerable, adding to that the terrain becomes slippery if it drizzles, other than that it is a must experience in Samal"
"ccduckie","Victoria, Canada","January 6, 2012","Natural","The falls were quite nice, although rather muddy and not the crystal clear water we were expecting. It's all quite natural, so you can rent a hut for the night, but no food available so bring your own. It's about a 15 mins hike in."
"japanagogo","Hong Kong, China","January 1, 2012","Splashdown, 2011","The atmosphere of Hagimit Falls is lovely. A refreshing, cool spot with several different pools and places to jump into the water, my gf and I spent a lovely afternoon swimming about and jumping from the falls (signs clearly marked the depth of the pools). Yes, one has to pay for tables to eat, but the prices are not exceptional (150Php for the cheapie, 250Php for a nicer table). A great place for families...we were surrounded by many Filipino families relaxing and enjoying the same atmosphere as us! On an island with not much to do, I'm surprised this attraction is ranked 3 of 4."
"Ingrid H","Oslo, Norway","November 8, 2011","hagimit falls","lovely afternoon at the falls! Great place, but very ugly pipes lying around everywhere."
"sunshine36NewDelhi","Shanghai, China","October 31, 2011","Where were the falls?","Not much to see or do here. We bought our lunch with us and had to pay to use a table. We thought that since we paid an entrance fee would could use the facilities for free. I would skip the falls."
"slazenger552","Davao City, Philippines","August 30, 2011","Relaxing place for family and friends","It's a very nice, secure place for family and friends. The place is a bit far from the city center but it's worth it when you arrive there. So refreshing, with P20 and P40 entrance fee for kids and adults respectively. It's like a hidden paradise in Samal Island. There was an overnight cottage which was still under construction. At the moment, only nipa hut cottages are available."
