"User","Location","Date of Review","Review Title","Review"
"Cecilia J","Geneva, Switzerland","May 6, 2016","Cooling waters in the heat","When visitors come over to Davao City and we have time for some pleasant waterfall fun, Hagimit Falls in Samal Island is something we look forward to. We usually go to ""Mahal Resort"", which has a short cut down direct to the falls from its parking area. Though called a ""resort"", it's really just a collection of huts where you can eat and put stuff on, with a collective bathroom and toilet, as well as four airconned bedrooms with their own bathroom, good for overnights or for the day, at reasonable rates. Of course, the main attraction is the series of falls and their basins where people and kids can go swimming or just plain dunking for fun. The water is usually very very fresh, but make sure it has not rained heavily the day before or there may be too much debris being swept away by the flowing waters. There is a little store that sells some drinks and snacks; other than that, you have to bring your own food, cutlery, etc. If you're nice enough, you could request the owner (if she is around) if her staff help could buy roasted chicken in town - of course in addition to the cost of the chicken, you'll have to pay for the transportation and give a tip. In our experience, having been here several times, the falls are always fun; however, it is true as in a previous review that more and more concrete is being built, which is definitely a pity. Also, sometimes the karaoke gets too loud - but then just go into the waters with the gushing flows and you'll hardly hear the horrible noise. Nevertheless, we always leave the place in a fantastic mood."
"Peter19502013","Davao","April 6, 2016","Paradise being destroyed by commercial interests ( concrete walls, fences , wire )","We have visited here many times during the past few years. In most countries a natural pearl like this would be protected from development by law. Not so here unfortunately. One developer has constructed bigger and bigger dams by concrete. This really destroys the feeling of natural beauty. Furthermore this developer seems not friend with the guy( s) next door so they have set up fences and even wire between the falls. A bridge has been closed with gate and padlock. It is really sad to see it going this way. But having said all above, kids seem to enjoy to swim there."
"she m"," ","March 18, 2016","Hagimit falls","Best of nature at no pay. I only pay for I thnk 40php entrance fee. The travel from park inn hotel would take up max 2hrs with traffic to these falls. Worth the time and money."
"Leydee D","Samal Island, Philippines","March 16, 2016","Nature","Affordable and cold running water. Visit on weekdays when there is no much people going. Good for big family and friends to enjoy."
"Mariel G","Baliuag, Philippines","March 15, 2016","Cold running water","We arrived at this place on a weekday! This is very convenient since we are the only tourist at that time. The water is clean and we only paid 20 pesos for the entrance."
"tainted_canvas","Philippines","March 7, 2016","Nice side trip","stayed here only for a few hours but my little girl enjoyed every bit of it. Since we are in Samal and we went on the island hopping trip, she really didn't have much time on the water because they were deep. She was wearing a vest though but still.. she enjoyed this so much. The water was good. Nice. It's still a natural body of water even though they turned it into a resort so there will still be forest-y stuff on the sides but it was still good. there are some vandalisms... but overall a nice experience. "
"BarryFisher","London, United Kingdom","March 2, 2016","Great inexpensive day out","Numerous small waterfalls and pools for all ages to play in. Lots of covered picnic areas for the family. A great and cheap day out.. great for families"
"Joy B","Iloilo Province, Philippines","February 29, 2016","One of God's best creation! ❤","We didn't swim because we had lack of time though we really want to.. people swimming there really had fun with the flows of the water.. it's really clean, clear, and cold water.. I would love going back here next time and will really swim. Wew! "
"KlausDORING","Davao City","February 25, 2016","Take a deep breath","Relax, unwind and feel the cool taste of nature. When on Samal Island, the Hagimit Falls are a must."
"Jay S","Davao City, Philippines","February 25, 2016","Most Underrated Place in Samal","I went here twice but dont let the tiring long stairs upon entry fool you. My first visit was awful because it was packed and a lot of people were smoking.   The second visit, however, was nothing short of revitalizing. We went in early around 6 in the morning and came in at the new entrance but to a lower level. They just opened and you could see how surprisingly safe to walk on rocks because they take out the moss cleanly.   I was even able to swin for 2 hours because of how refreshing the water was and how convenient some parts are due to the natural shade of trees.  I will be back. That is a promise. "
"Angela M","Pasig, Philippines","February 12, 2016","Nature + Lanscaped","accessibility -good via habal-habal view - good. nothing unusual. amenities - fair. with cottages etc. Compared to other falls, this fell short in meeting my expectation. Maybe because most part were already landscaped and there are areas where the water are already stagnant."
"GraceJ1"," ","February 10, 2016","Exploring ","Thiers no words to say it's a beautiful place love to come again it's very affordable and amazing place"
"SimonDabbs","Melksham, United Kingdom","February 9, 2016","Beautiful location spoiled","Hagimit falls is OK. But why did they have to spoil it with so much cement? It's a lovely place... so tranquil. Why spoilt it by cementing-in a wonderful, natural place? But it's still nice for a refreshing swim in cool water, I guess. Just...More"
"Kates A","Cavite City, Philippines","February 9, 2016","Close to nature","What i like about Hagimit is the size of the area. There are smaller cascade of falls and multi-layered natural pools. Some parts are dirty due to leaves, rotting branches and water seems stagnant and murky but to be fair, that's how nature goes. I...More"
"Jonamarie S","Davao City, Philippines","February 6, 2016","Beyond expectation","It's my friends first time in Mindanao, it's all our first time in Hagimit. What welcomed us was beyond what we were expecting. What a wonderful creation of God. We all kept FALL-ing in love with the place. Falls after falls.. wahhh. We cancelled out...More"
"Jake2014jake","Pasig, Philippines","February 4, 2016","Being one with nature is easy here!","Imagine the sound of flowing water, of cascading water, relaxing, soothing. Imagine lush trees and vegetation, where you can either lounge and rest and have a picnic, or walk around and feel closer to nature. This is what you will find when you visit Hagimit...More"
"Yna Clarissa F"," ","February 3, 2016","Amazing 1","We went there August last year,and I told you guys it was so amazing,cooling and relaxing place. My kids are very amazed too."
"Christine Joy M"," ","January 28, 2016","Not as beautiful as you see in pictures ","Or maybe we were there on the wrong season. Or maybe there could just be so much people on one place at the same time. Or maybe because I've been to better looking falls. Nevertheless it was still beautiful but did not meet my expectations."
"Edlyn A","Davao City, Philippines","January 13, 2016","Adventures!!!!","I really love this place ... My brother and my sister was so delightful because I took them to this place. This place is very perfect for family and friends... 😍😍"
"Marga A"," ","January 8, 2016","Hmmm","Chlorinated-man-made place. I was expecting more but it didn't really deliver. It's not what I expected and a bit dirty. I could smell chlorine in the water which was super weird."
"Mikas101","Singapore","January 5, 2016","Multiple Falls & Multiple Pools","It is a unique place and experience to behold, as one enters the waterfall park. There is a long trek; roughly 500m-1km from the car park to the main swimming areas, but the Government did a great job of cementing steps and there is a ramp which makes it easier. Get ready for some cardio so that your body gets warmed up for the cold plunge in the waterfalls. We took a stroll around the park before going to the main section where everybody was and had a great time enjoying the scenery. The place also has multiple pools for you to swim in and its scattered around so despite there being a lot of people, it does not feel packed. Its unique also that it is in a sense not just one single plunge waterfall but a bunch of them scattered around due to the nature of the river and streaming of the water. And as all Filipino public parks, one can cook or bbq there, but they did a great job in separating it from the main pool areas. There are acceptable changing facilities and toilets there.   Entrance fee:P40 Cottage/Table Rental: P150-P250"
"Ralph S","San Antonio, Texas","December 21, 2015","Wow, what a nice surprise!","The park is about a 10 minute trike ride from the Babak Port which you reach from the SaSa Port in Davao. You can catch the ""banka"" people boats from the Sasa Palenke (market), or the big car ferry from SaSa port. The fare is only 10 piso each way. Once you get to Babak take a trike to the park is about 250 piso (foreigner price ;) . After you enter the park it's about a 5 minute walk down the hill to the falls. The falls will leave you amazed. You can rent a table for 150 piso or a nipa hut for 250 piso. The locals sell beer and soft drinks, no need to bring your own. The toilets are in good shape. You can rent a hut for overnight for 600 or 1000 piso, but no electricity...No swimming after 5pm, so why bother staying there overnight? The walk back up the hill is good exercise...lol The place is crowded on holidays according to the very friendly local workers. We look forward to our next trip back in the new year."
"Rexoy","Davao","December 12, 2015","A good place to end the day","After going around samal in a hot and sunny day its a good idea to end it at hagimit falls by dipping in its cool water and have a relaxing or rather a hard hydromassage! Be prepared for a bit of long walk downhill and back uphill!"
"Adventurer996","Tampa, Florida","December 5, 2015","Beautiful falls","I only had a short time there, it started raining but it is well worth the entrance fee! You can eat, drink, and swim"
"calub m","Cavite Province, Philippines","December 2, 2015","A natures way to massage","We did not expect that hagimit falls are composed of several layers of torquise cold water. You can occupy any spot where you can enjoy more the falls. We did try 2 spots where it is not too deep. then the other one where you can swim and jump from the stones :D what i did not like is that there is this area ""Mahal kita Resort"" they have a gate which is open to public. But when your inside and used their ""Balsa"" you have to pay them. We did not notice the sign, but we were dis appointed how they treated visitors/tourist they locked the gate prohibiting us to transfer the other side of the falls. And what they advised was for us to just cross the gate ""over the bakod"" how come they were too lazy to open it for us. "
"Harvey T","Davao City, Philippines","November 24, 2015","Nice Surprise!","I heard about Hagimit for quite a while now but I visited the place just recently for the first time. My expectation was low and it was an unplanned visit. Time of visit was really early in the morning, around 7AM, and we are few of the first guests to arrived.  Our plan back then was just to see the place and take some pictures. No plan of taking a dip at all because we are heading to the beach. Our short trip to the falls ended up with staying for 3 hours of taking pictures and swimming on its small lagoons. The water was clear and the lagoons have the hues of torquise to blue. Water is cold and very refreshing.  The area is a bit small so I imagine it can get crowded during weekends. I hope the management will limit the number of heads who can visit to maintain its cleanliness and damage to nature will be controlled. Entrance fee is P40.00."
"Morris Adelon A"," ","November 23, 2015","Multi Flowing Falls","Exotic place were you can stay to enjoy a relaxing dip. Experience the cave behind the falls and jump off the deep part. Ask for assistance with the locals they are glad to assist. Tables with shade are available for your convenience. Remenber water is cold."
"MarieMarc2014","Mandaluyong, Philippines","November 23, 2015","Get in touch with Nature","I love the sound of the rushing water. The cleanliness of the place. The people are nice and accommodating. A true beauty."
"Nickate N"," ","November 19, 2015","Great view and clean falls","huge places to walking around clean water and very clear , nature friendly , quiet and very comfortable . Relaxing and nice view and lots of cottages u will be stay and accommodating also."
"Elmo B","Manila, Philippines","November 19, 2015","Miniature Falls Worth A Glimpse For Those Who Have Not Seen One","For those who haven't seen a tropical waterfalls or any waterfalls, Hagimit falls would interest you. Perhaps around 12 feet on the tallest one. The premises also offers cottages and picnic tables. A few people we saw taking a dip on the water. A few houses around the falls a bit an eyesore. There was also a resident dog loitering."
"alinebuizon"," ","November 19, 2015","Hagimit Falls","A must-see in Davao, Samal Island. Though far from the city but you will enjoy the boat ride and the habal habal ride from Sasa Wharf to Penaplata. You will wonder where the water is coming from. There are layered of mini falls aŕranged magnificently. Amazing work of nature. You can choose your own spot and get a self massage in the falls."
"jed1017","Metro Manila, Philippines","October 28, 2015","Nature Trip!","Nice falls.. There are many people when we went there but we still enjoyed the view. Just be prepared for a long walk."
"Jameson L","Antipolo City","October 3, 2015","Nature's plus","Hagimit falls is a very refreshing place to visit. With its multiple 'mini' falls to look at and experience. Although the place, just like other places, has its pros and cons. If you are a senior citizen you'll have difficulties navigating its long steep stairways. But if you're adventurous enough this place is worth trying."
"Mars_Hilario","Davao City, Philippines","September 30, 2015","Falls In Love","A good side trip there is the waterfalls hidden in the forest. We walked almost 1 hour and we walked 10 minutes to visit Hagimit Falls. It’s one of Samal Island’s great natural sights and worth the effort, just enjoy the trek as it is a really trek to nature.  For the nature lover, you can spend your day here with a grilled meat with an ice-cooled beer while enjoying the cool-breeze of nature. Chillax!  I love the place, small but terrible!"
"Vince M"," ","September 24, 2015","It speaks eloquence of Nature","It is a unique place to see, enjoy and take a plunge. It is in the heart of Samal Island which offers fresh water dips for the whole family."
"Anna May V","Pasig, Philippines","September 19, 2015","Cool Waters, Great Views, Simple Amenities","Entrance is 40p, there are a fair number of steps to descend (and climb back up later). Cottages range from 100- 250. I suggest you rent one, otherwise you will be charged 10p per use of the restroom, changing room, open shower.  This soured my experience a bit, since we settled on an unmarked cottage (no fees posted anywhere), and before leaving a lady approached us and wouldn't budge until we paid her at least 100p, else she would charge us for each use of the facilities.  Other than that, the views were great (you can't take a bad photo), the water cool and refreshing. The rocks are a bit slippery, but there were life guards and there are life vests for rent. You can also ask for services of a guide to assist in deeper waters.  I'm still glad we went, and might even return when in the area."
"robmaghinang","Valenzuela, Philippines","September 12, 2015","Reconnect with nature.","Just visited Hagimit Falls yesterday on a solo backpacking travel. Here's the rundown:  The upside:  1. Easily accessible from prime tourist spots via motorcycle.  2. Raw beauty of nature with some modern amenities and electricity but don't expect too much. 3. Cheap entrance fee of Php 40 (less than US$1).  The downside:  1. During my stay, I don't see much uniformed security personnel or life guards roaming around. 2. Rocks could be very, very slippery. If you see it green, test it first for moss that make things a bit dangerous to step on. Be wary of the color of water, the bluer the deeper and the holes could just be right beside you. 3. Needs maintenance."
"Ramon F"," ","September 5, 2015","You shall not pass!!!","Thats right, you pay the first entrance at near the road, the second approaching the resort. After that you descend down the falls,so i took the left, theres this lady who greeted us with ""cottage"" for stay, we said no because we'll just take pictures and we're backpackers, after that we decided to take the same path back to exit, this woman told us we are not allowed to go through there anymore, so we where confused, she said we didnt rent her a cottage and we cannot have access to that exit, she said we should take the long hike to the exit, so we did, beware of that woman, shes like gandalf, and oh by the way the area is not great, vandalism on some rocks, water not that special, not clear, EVERYTHING IS A RIP OFF..."
"Vanessa G","Manila, Philippines","September 2, 2015","Breathtaking but so many people","Falls are really breathtaking as there are a lot of areas to swim. However, some are really deep and needs to be cautious. Lots of locals come here so expect a lot of people."
"Berna T","Las pinas","August 25, 2015","Needs proper maintenance","Going to hagimit falls is an easy 30 to 45mins habal-habal ride from pearl farm. It could be very hot on your way so a sunblock will surely be a lot helpful. I advice that going there you should be in your swim wear because the place doesn't have a decent area for changing. It will be a lot ease that you'll just have to dive in those inviting waters upon arriving. Yes, it could be a hot day going there, but the comfort of diving in the cold hagimit falls could be really refreshing. The waterfalls is clean, maintained and with quite a number of lifeguards you could pay to accomodate overseeing your swimming children if you decide not to swim for a minimum fee. They Also provide rentals for life vests so if you are not a good swimmer you'll feel confident jumping in. I am amazed at how they were able tomaintain the waterfalls area free from vandals but I however feel sad that the area going to the main waterfalls fell short of my expectations. The waterfalls is located about 500m walk down a cemented stairs which in my opinion has ruined the total nature feel for the place. Although, I guess this set up has helped a lot of senior citizens in reaching the place but I'm thinking of using other materials for a stair than having it cemented. It also saddened me that there were vandals in different areas that I almost didn't want to finish the trip. Luckily we finished and it was worth it. My children enjoyed their dip."
"RickN6900","Los Angeles","August 20, 2015","Nice place to visit on a hot afternoon","Nice relaxing place but quite a few steps down and of course, back up. Water was brisk and the falls are nice. Great place to go with a group for a picnic or bbq."
"Bygz P","Davao City, Philippines","August 10, 2015","Excellent place to Relax and to have a Massage from the Nature","If you're wanting to have a break that is exciting but as the same time relaxing, then I guess this place is right for you! you can actually go to this place just by renting a ""Habal-Habal"" motor - a single motor that cost 100...More"
"Audreeadjel"," ","August 5, 2015","HAgimit falls","We rent a habal habal (single-motor) for 100 pesos each inclusive of back and forth going to hagimit falls dont know if its expensive for the fare. We have no intention in dipping as we want only to explore. Main entrance is 40pesos and far...More"
"Vsevolod L"," ","July 27, 2015","Strange","This is a strange place. I wouldn't call it waterfalls since it is basically stones that water runs over and eventually falls for some meter. The water is nice to swim in and chill for a while, but there is not much really to see....More"
"bernzepol","Bournemouth","July 20, 2015","Fantastic!","Yes, from a great nature lover it was fantastic. There were 3 levels of waterfall. With the help of the guide, manage to climb up there. Stairs were a bit rickety, but its part of the fun. They are currently making improvements on the site...More"
"SGregersen","Kalundborg, Denmark","July 4, 2015","Great fun","From the parking area we walked along a number of tiny falls, where the local kids were playing and having e great time. The peak of the trip was the wide 8m tall fall, where lots of people enjoyed life in and out of the...More"
"Dragon51","Jersey, British Isles","June 30, 2015","Overcrowded and Underwhelming","It was school hols so I guess a place like this will be overcrowded, but I guess my friend's son had a thoroughly good time. I found it underwhelming being quite dank humid down there and the hundreds of steps down (well possibly an exaggeration)...More"
"WanderLustDavao","Davao City","June 28, 2015","Beyind the beach","Samal Island is not all beach. Hagimit is one of their popular inland attractions. The area is composed of various pools where the waters cascade into, so you can find your own spot to enjoy Hagimit. Takes some short hiking to get to the llace...More"
"ANNann00","Philippines","June 21, 2015","Nature's beauty","This is the first time i came around the falls and it was awesome, makes you appreciate what the nature can do. The falls are small but so refreshing and clear. Be ready to jump on the water!"
"vardkeem","Cebu Island, Philippines","June 18, 2015","mini waterfalls, around 2 meters","PROS- cool waters after the beach and near from the road CONS- shallow water and small waterfalls, no place to buy food and drinks"
"Elliot P","Caloundra, Australia","June 17, 2015","Just awesome","Clean and full of things to explore. Plenty of places deep enough to dive into. Also has a secret cave behind one of the waterfalls that's cool to go into. Good fun to travel from one end to the other through and up the falls if you are daring ☺"
"Len V","Manila, Philippines","June 4, 2015","Relaxing and refreshing....","Away from the hassle and bustle of city life and yet not too far to go.. The sound of water falling is so relaxing.. so clean and refreshing.. I always enjoy nature..a paradise to my eyes...The staff are helpful and the entrance fee is just minimal.. Good for family getaway for a day!!!"
"lytzfmarchan","bacoor","May 28, 2015","nothing fancy- smaller than other falls","not much space for lounging or sitting and less activity. too many people when we were there so we stayed for less than an hour and left."
"joann c"," ","May 19, 2015","fresh water to bath with","this is a public local camping/outing park. it cost 50 pesos per person to get in the park. It is not handicapped friendly. the walk down to the spring can be slippery when it's raining. This place is still not develop. a little walk up the park and we see where the water came from. there is another 10peso per person to swim closer to the spring."
"KB D"," ","May 13, 2015","Nice trek, cool falls, worth visiting! ","My buddy and i arrived late in the afternoon so as soon as we got off the habal-habal (motorcycle) we dashed downhill to the falls (entrance fee is 40 pesos). It was a pretty sight! Several low to medium-height falls are in the area that feed five to six feet cool pools. Huts line the falls where visitors can have picnic and karaoke. There's resorts available in the area should you wish to stay overnight. Must never miss this when in Samal Island! "
"MrDestiny","Sydney, Australia","May 11, 2015","Another natural place ""improved"" with concrete paths","It would be nice if places like this used more natural products that blend in with the environment, rather than overdosing with concrete everywhere. So I had to use my imagination to think what it must have been like originally before it was turned into a money making operation. There was quite a crowd there when we visited, I think I was the only foreigner, and the locals were enjoying themselves in the various pools. I couldn't help but see many potentially dangerous spots and wouldn't be surprised if there had been accidents there, especially as many Filipinos don't actually know how to swim. The other thing I noticed was a lot of trash, such as plastic water bottles strewn around on the ground, and also to a lesser extent in the water. It must have been a beautiful place once upon a time."
"nheesa"," ","May 1, 2015","Nature <3","I went here last Feb2011 and it really changed a lot. Fair enough because there are a lot of tourist who enjoyed going there. The entrance fee is Php40 the habal-habal ride is about Php 80-100 depends on where you are from. If you love nature then this is one of the best places to go when you visit Samal.   There are signs that you can't dive but we are just as hard-headed as the others. :) it's a very fun experience."
