"User","Location","Date of Review","Review Title","Review"
"Maria I"," "," ","Cool ","Nice place , full of people .. a lots of small waterfalls.. fun place. If you’re looking for a place to make a grill and relax all day here it is !!!"
"Steve J","Norwich, United Kingdom","5 days ago","Worth a look ","We went there on a Sunday we did feel we were the attraction being white tourists but everyone was really friendly Make sure you take your swimwear"
"Karen N"," ","4 weeks ago","Worth the visit","We visited Hagimit Falls as part of our inland tour. The guides are amiable and very helpful. They sure know how to take pictures for your profile picture! The cliff jump to the 13ft deep water is definitely fun and the cave slide is a new experience for me. Kudos to the guides! "
"matei823","General Santos, Philippines","March 8, 2018","Nature! Great side trip","My kids had a blast exploring the many pools. We enjoyed the cool water from the falls. For small kids though, they need to be held and should have flotation devices. The trek upwards after the swimming, not so enjoyable! Overall, a must experience for those who travel to Samal, especially during the rainy months. During the summer the falls have just a little volume."
"Chris P"," ","February 15, 2018","Ok for kids? ","This is a perfect example of how to totally destroy what once was a beautiful place! Garbage everywhere. Fake concrete pools and waterfalls. A huge disappointment!!!"
"RamDurai","Kuala Lumpur","January 24, 2018","Beautiful","We had a great time hiking around taking pictures just wished we swan in the falls.Might be a little hard to find but worth it."
"Peter T"," ","December 21, 2017","Small and safe water fall - a treasure for kids","It is a small waterfall. The lifeguard posted near the fall help new visitors by guiding them and taking them through a cave inside the fall. My son loved the trip and did multiple rounds inside the cave. A small tip made the lifeguard happy. Non slippaey and 5 ft water."
"MrSnatch","Worcester, United Kingdom","December 11, 2017","Nature Tripping","If you want to go nature tripping in Samal and enjoy some cold water, Hagimit is definitely one of those. Just pay 100 pesos for the entrance fee and 5 pesos for the environmental fee. Just a tip, bring food as they dont have food stalls where you can buy food."
"jgayongorsa"," ","November 20, 2017","A breath of fresh air","Having past hagamit falls the other day the wife and i decided to go back there today having checked out a few reviews . It was about 10k from where we are based in lanang. So we fueled up the scooter amd went, it was real easy to find clear signage on main road. Upon arrival we had to pay 5 peso each enviromental, the track down to the falls part concrete part dirt track, plenty of parking and a small store for basic foods amd drinks. Entrance to get us both to the falls was 150 peso there are two parts to this place the free amd the waterfalls source. I must say at this point if you have elderly or disabled in your party its a no as there an incredable amount of very steep steps down to the resort. The park itself has local native people living in and around the area which makes it work well all very friendly. On route you get a glimpse of what you are going to and it was awsome blue looking river very clean i couldnt wait to get down there, its about a 15 minute walk. Finally all you can here is the sound of the fall ! So very relaxing , i just wanted to get changed and jump in, there were some locals already there swimming, again friendly and approachable they said it was deep enough to jump off the rocks so i did!so invigorating clean cold water peacefull and sureen. A great place for pictures and over all well worth a visit, ill be taking the kids there for sure"
"UsapangGala","Pasig, Philippines","October 18, 2017","Swim and Trek","Advisory: 1. I won't advise the place if you have elderly with you. The place requires climbing up and down. 2. Don't set your expectations very high. For me, the place has didn't us a ""wow"" factor but the place is still worth it. The water is not that clear too. 3. If you can't control your kids, don't bring them to this place.   The place is not bad, although I didn't like after your enjoyment on the swimming you may become exhausted when climbing up to the exit.   I hope the place should be maintained otherwise the beauty of the falls will be lost. "
"seedhunter","Hyderabad, India","October 13, 2017","Not so impressive","Although this fall is located in serene ambiance, it is just very ordinary waterfall. But good place for picnic and swimming in cold water. Fee 15 Peso."
"Richee Genesis T"," ","October 10, 2017","Picturesque","P15 entrance fee which is really really worthy. The place is really beautiful. I suggest to go early because at around 10am, people starts to go there and it would be not okay on pictures. Haha. If you're gonna swim, you are required to rent a cottage which ranges from P150-400. Everyone should try the cave hidden at the falls. Quite an experience. "
"Ricky P"," ","October 9, 2017","I wished it was raw","The beauty of nature is not alleviated by any man-made improvements. In my honest and personal opinion, every natural tourist spot should only be reserved by keeping it clean and not modifying it by creating something just for human comfort. This falls should have been a lot more beautiful if it was not turned into a resort type spot. "
"queenmary28","Pagadian City, Philippines","September 13, 2017","Educational Tour","i was so amazed the beauty of Hagimit Falls as my first time to enter Davao. The water is so clear and cold. You can swim how long you want, and you can wear also life jacket for as long as to maintain your safety."
"Aya K"," ","September 10, 2017","Nice, but...","It had rained the night before we went to the falls, so the water was muddy. They only collected half the price because of that, Php50.00 is the regular entrance fee.  We did not stay long as there was nothing much to do with the water looking like that. However if it had not rained, i imagine the place is nice for family getaways or for those who just want to spend some time with nature."
"jonalber2","Singapore, Singapore","September 5, 2017","Like a massage shop you never want to leave","Unfortunately, the rain was pouring when we visited Hagimit Falls on a habal habal. That day, the water looked murky and brown. Our guide said that on a normal sunny day, the water is bluish. Eitherway, already wet and tired, we took the plunge. Once on the rocks, with the water on our backs, my muscles were singing out in praise! This was a great massage to end our day of touring Samal Island. We stayed on the rocks (thank God, we didn't fall asleep) for what felt like hours.   The stairs going down the falls, is very manageable. Not challenging at all. There are also small shops at the water's edge selling snacks."
"Sony A"," ","September 2, 2017","Worth a Try","So this is one of the few trips you can explore in samal island , even though its not really well maintained because of vandalism everywhere, but having said that this place is a worth a try, also its very cheap , from entrance fee to cottages and overnight !"
"Tony_King_Jr","Davao City, Philippines","August 9, 2017","Just don't give up easily","Don't be discourage when going down the stairs. Just be mindful of your safety and belongings. I didn't saw any lifeguard in the area."
"Cza C"," ","July 28, 2017","A bit dirty","The place is okay .. the trip was worth it except ror the fact that as time goes by trash can be seen eveyrwhere in this place... a lot of tourists are just throwing trash everywhere .... the only thing good bout the place is the falls "
"Ronna V"," ","July 17, 2017","Cold water 😄😄😄","One of my itinerary in salmal trip is checking out this hagimit falls Just right after my taclobo tour i went here. 40 pesos entrance and theres a local guide inside the park..  Its up to u if u will give a tip of not  I gave 50 am.not rich am just budgetarian backpacker.  The guide is great and accomodating.  Ok went there weekdays so the place is not crowded.. Some locals and a group of indian medical students from davao..   The place is nice.. And the water is cold. I love it. Went inside the small cave behind the falls ...  Its a must see if ur not in a hurry and u want to relax with the falls ..but i guess weekend will be full of guest.  Am.happy :) "
"Januspaggers"," ","July 15, 2017","Fuuuuun!! ","As soon as you enter the location, you'll need to trek over a flight of stairs before reaching Hagimit Falls. At first, it's pretty underwhelming since it's just a few levels and not that steep but there's more than meets the eye. There's a staff that is willing to help be your on site photographer (we didn't really sign up for it but it was a great surprise). He's a guide that knows the ins and outs of the falls to give you great insta photos. Apparently, there's a small hidden cave inside the falls and you need an expert to help guide you. There's a sign that says ""No jumping"" but he'll tell you the perfect place to stand and where you should jump to make it safer. All you have to do is to give him a tip.   The benches and huts are charged so we just placed our stuff by the side of the falls. Plenty of other stuff to do but we were already satisfied with the photo ops and the tiny cave. "
"jonsapon121"," ","June 8, 2017","Nice experience ","Fantastic falls. There are some people to help you climb the falls, just tip them. Good service would bring friend next time"
"Jose Victor M"," ","June 1, 2017","Another way of relaxing in Samal","It just takes a short walk and you will arrive at Hagimit falls. We have done a bit of exploring here too and as you go downstream you will see some resorts with rentable huts if you want to have a picnic here. The water is refreshing to swim in so don’t hesitate to take a dip with your companions and enjoy the sound of the falls. It's another way of relaxing in Samal even when you're not in a beach."
"ALventureBlogs","Quezon City, Philippines","May 28, 2017","exciting waterfall","Water is good, cool and clean!!! But man-made structures altered nature. Budget friendly trip. Good for family outing and bonding"
"Roxy604","Vancouver, Canada","April 27, 2017","Nice place to spend the day; popular with locals","It’s quite a ways in (from the highway) to even get to the entrance of where the waterfalls are. The road is very narrow – one lane going both ways; give and take for sure. Small, low-lying cars not a good idea on this path. It’s quite far from the main road, but if you don’t mind the walk (most people do), it should be fine.  It’s probably prettier when it’s brighter out, but when we went there it was a little gloomy so it didn’t look quite as great. It’s a busy place, lots of people having picnics and swimming in the pools by the falls. I believe you can rent little huts and tables for picnic purposes. The main waterfall area is quite busy, but there are other quieter areas around the property, you just have to explore and go against foot traffic.  There isn’t much to see here. So unless you are planning to stay and have a picnic and going swimming, might be best to skip it. It’s just not worth the hassle just for viewing purposes. Also you have to pay a fee to get in."
"niccaalyssa","Manila, Philippines","April 26, 2017","Beautiful View.","This was one of the most beautiful place of Davao that I had visited so far. The water was so refreshing because its cool ( i mean icy cool). The people there were that very accommodating that they took our picture from top till we drop. Plain is beautiful. "
"Luchie Kin A"," ","March 27, 2017","Summer Samal Island Tour","This place is quite nice.. Not as what I expected from the viewed photos on the internet. But surely a great place and wonderful falls 😂 cottages are expensive I find it unreasonable for the place."
"Leiann L"," ","March 2, 2017","Best place to cool down after a tiring day of island hopping","The place is very big and lots of falls to choose from. It can accommodate as much guests as possible. Cottages are spread around. Better to go bere after a very tiring day as the water is very relaxing and fewer people go there around 4pm. The entire falls will be all yours once families and friends go home late afternoon. But not advisable for elders or people with weak knees as there will be a lot of walking on stairs. Ample space for parking."
"Jennelyn T","San Jose del Monte, Philippines","February 20, 2017","Cool waterfalls with a cave inside","The waterfalls were like a therapeutic massage, plus the water is cold, at the side of the falls is a narrow cave (not for the claustrophobic). A very scenic place as well..."
"jan j","makati city","February 14, 2017","Nice place for picnic and little adventure...","Descending down to the falls has been made easy by the cemented stairway. The place is cool and relaxing. Many nice spots for picture taking. It is my first time here to jump off a cliff. And get into a small cave and swim my way out to the open... Worth visiting. There are also huts and grilling place for rent. You just need to bring your own food and buy coconut juice and sticky rice cake from the locals selling along the road to help the locals..."
"Milany A","Davao City, Philippines","February 4, 2017","Coooollllllddddd Water","The place is crowded on weekends but the water remains cold. It was awesome! And very affordable! It is also an adventure going there on a bumy ride or in a heart-wrenching hike. But still, it's a good place and I highlyrecommend it to anyone who would like to relax. It's worth a visit. "
"Victorianlad","Melbourne, Australia","February 3, 2017","Worth a quick visit but not a huge falls","There is a P5 environmental fee charged at the turnoff from the main road with a further P40 payable after a few hundred metres of tricycle travel.  One then walks 300 metres along an at times steep path that has a ramp or steps to reach the falls. Here someone tried but failed to charge me again, perhaps believing I wanted to use a table, although there were only two.  The falls had a good flow but they are only a metre high.  It is worth a visit but do not expect the falls to be anywhere near as good as Tinago Falls outside Iligan City, Mindanao."
"DonDan16","Hamburg, Germany","January 22, 2017","Used to be so nice","The falls are phantastic. Clear cold water. A very beautiful thing.  Not beautiful is the crowds of people making noisy music abd throwing their garbage everywhere, on the ground, in the water, unbelievable. There should be more waste baskets.  Ugly also the tons of concrete and the many buildings there. If you go there on a weekday off season you might have the chance for some silence. "
"Gabriel M","Taguig City, Philippines","January 11, 2017","Cool and very nature","We had a great time with my friends and stayed here overnight... Enjoyed the cool water and the very natural beauty it can offer.."
"krisna m"," ","January 3, 2017","Cold waters","Its my 2nd time in Hagimit already and what I like is at the top because the water is cold and fresh but there is an additional fee if you wanted to go there."
"macasaetchris","Makati, Philippines","December 14, 2016","Place time to visit is during summer","Entrance fee: 10 pesos Hagimit Main Entrance Fee: 50 pesos (Discounted because the water wasn't clear)  It was rainy when I went here. The water was muddy unlike the pictures but mainly because it rained hard the night because and during my stay here. But I bet this place is as good as advertised. I'll be back soon! "
"Dennis R"," ","December 14, 2016","Dont Go if Raining!!","We went here and the tricycle driver said that The Water in the Falls is not clear coz of the 2 day rain.the road going down the Hagimit Falls is very very slippery.Dont wear fitflops and just dont go there when its raining.you wont appreciate the beauty of the falls :( "
"April C"," ","December 1, 2016","Hagimit Falls in Samal","You just cant miss this when you're in Samal. Definitely a must see. There are about three different falls areas where you can swim and relax and there are really helpful guides in the area who are willing to help. These are locals and some ""tips"" or gratuities will be much appreciated. "
"virmen","Malaybalay City, Philippines","November 21, 2016","chasing waterfalls","chasing waterfalls, hmmmm even t he waterfalls is not soo nice but the water is very clear so it adds the beauty in this place."
"Wreckxki","Quezon City, Philippines","November 18, 2016","Small Falls","It was easy going to the falls because you need to walk down a flight of stairs, but it was tiring going back to the entrance.   It was a small falls, we went there on a Tuesday but there were quite a number of people. There are tables and cottages available for rent around 150php I think. It would be better to take food/drinks with you because there are not a lot of stores available.   Since there are other falls that are better and nicer in Samal Island. You may skip going to Hagimit especially if you are only on a day tour."
"Pio S"," ","November 15, 2016","It was so so","I didnt like the way it was maintained. It lacked a little bit of organization. The stores there had limited food being sold."
"Karakus77","Emirate of Dubai, United Arab Emirates","October 14, 2016","Cool down under the falls","Was nice going down under the falls with an old fashioned raft , u can swim and have shower under the falls , get ur fridge magnets, eat local food , have massage , little fishes come and tickle ur feet in a little pond , was Awesome , pple are soo friendly "
"MediciBoy"," ","October 4, 2016","Beware of this tourist trap","Fees will be asked from you naturally but the moment you step inside that's where the nightmare starts and where the con begins. Sitting on a table next to the falls would cost you somewhere around 150 to 250 pesos and that is depending on who owns the tables.  We didn't spend much time on this horrid place because it was way too crowded. We decided to take the shortcut going back up to where we are parked and to our surprise we were being asked to pay if we would like to use the short cut and the only way we will be allowed to pass there is if we use one of their picnic tables which is far from where the falls are. Unsurprisingly there's a sign on front that says passing through the short cut is free (I assume its the city government who placed it) but the business scam situated right next to the short cut stairs wouldn't allow you unless you pay or you use their tables which is around 150 pesos if I remember correctly. Again, this is a PUBLIC are and this is way too crowded with minimal facilities. So go at your own risk but personally this is rather a waste of time."
"jtwanders","New York","October 3, 2016","Popular Samal Attraction","We visited the falls as part of a day tour. It was pretty packed with people swimming and hanging around so we didn't stay too long. Should you visit, I'd recommend walking around to the other end of the falls which is secluded providing shade and falls without all the people."
"Stuart H"," ","September 23, 2016","Family visit","Nothing to get excited about, a family water park with small natural pools for bathing, there are drink and food amenities on site."
"Kazumi S"," ","September 21, 2016","I love fresh water","First , when i saw the photos on google i feel like i don't like it there but my friends wants to go to experience the hagimit falls, the fresh water ,the view and etc. and here comes the D-day. I enjoy a lot. i love the water , the view and the little cave inside the falls. It's awesome =!!!! "
"77Raine27","Cavite Province, Philippines","September 8, 2016","One of the main Attraction in Samal","Locals and tourist would visit this place to swim and enjoy the falls, You would need to walk at the topmost portion of a mountain. Has several clear water flowing from the mountain. There are huts where you can place your things and have picnic. There are also stores inside where you buy sodas, crackers, chips, among others"
"KISSoulRock","Manila, Philippines","July 23, 2016","Nature At It's Best","Wonderful Place... Within Samal Island... Great for a refreshing & cool swmming experience... my Family had A Great Time."
"thess-rhina","Muntinlupa, Philippines","July 20, 2016","Just quite fun","Its nice place but dont go over weekend bcoz its too crowded..and dont expect much..cottage need to rent and need to pay entrance fee 40 pesos.."
"Aphio1925","United Kingdom","July 18, 2016","Not much","Went there thru a single motorcycle . It wasn't a good experience as i am scared of single motorcycle , but that time i dont have a choice. Saw the waterfalls and there was only a little water that flows on it at the time of my visit. Very few tourist was there and it was so quiet and we didn't even stay for more than ten minutes."
"MJeR","Davao City, Philippines","July 13, 2016","Overcrowded","I was kinda expecting of an enchanting feeling but i just find the place overcrowded. I didnt find the long downward walk compensated by the place. I didnt find the place to be clean since there's a hell lot of people everywhere. Like everywhere. Swimming area are mostly man-made.  If you wan' serenity, relaxed and safe swimming time, this aint the place for you."
"JMHerald"," ","July 10, 2016","Include this on your bucketlist when you go to Samal Island","I enjoyed our visit here during our trip to Samal Island. The falls is just marvelous when you see it. You can jump on top of the falls (its not that high) but it's not recommended. The water's cold which is very good during summer.   I should highlight though that you can enjoy your stay here without renting any cottages. Our group just saved P300-500 by not renting a cottage because we just placed our items on the ground. Be mindful that locals will come and will charge you of cottage fees just by placing items, or staying for a while, in a cottage."
"Jona A"," ","July 10, 2016","Commercialized but still got a nature feel to it","Good for a daytrip. Entrance is 50 each. There is an area there that is more secluded and the water cleaner - you only need to pay P20 more. Bring your own food. Dont go on weekends."
"Andrew P","Swansea County, United Kingdom","June 26, 2016","Brilliant","Came here to see the falls and I had a brilliant time. The area is very interesting and a must see place for any tourist visiting. It's fun to get to and fun while your there"
"Michelle V"," ","June 13, 2016","Best part of Samal Island tour","Best value for your PhP40 entrance fee. We were able to explore and get to different levels of the falls with the guides there for a minimal tip, but we based it on how much we enjoyed the adventure they got us into and for ensuring our safety.  You may contact Kuya Jun (‪0930 981 0216‬) for your Samal Island tours (has tricycle w/c can accommodate at least 5 more passengers and a good photographer). He can include Isla Reta as your fifth destination to the standard 4 destinations(Monfort Bat Sanctuary, Hagimit Falls, Taclobo, Maxima Aqua)in the Samal Island tour. Entrance fees, environmental fees,fare to Taclobo and Isla Reta are excluded from the PhP1500 rate (as of 2016). If you wish to avail a boat for private tour of the beaches in Talikud Island, you may also ask Kuya Jun, rate as of the moment is PhP3500/boat."
"Atila E","Izmir, Turkey","June 10, 2016","Excellent for swimming","In Samal ,island you can spend one day here. Falls make some pools to swim. Water is quite chilly. Very good for hot days"
"Dan S","Spring Grove, Pennsylvania","May 22, 2016","Excellent area to cool off","The falls were a real highlight for me. I enjoyed the jumping, climbing and generally just playing in the water. It's a cool, natural spring and river and a great natural resource for the locals of nearby areas to visit."
"babykeaamiche21","Pescara, Italy","May 15, 2016","Must visit in Samal","When we went there on a weekday morning and we were the first ones to visit the falls. Actually we were just planning to take some pictures and not swim because me and my sister don't know how to swim well. Anyway, the kuyas there told us to swim and take pictures and assisted us.   I don't know if it tends to get crowded during weekends, but I do suggest going there on weekdays and early morning.   By the way there's an environmental fee you need to pay aside from the entrance fee."
"Pietro B"," ","May 8, 2016","Nice cool fun ","Great get away from the heat. Make sure you bring some food and drinks and relax by the river with many waterfalls. Good fun"
