"User","Location","Date of Review","Review Title","Review"
"small-skiing-mole","South East England","4 weeks ago","Plenty of eagles and other birds to see and informative film in a side room","I believe this place does great work, breeding and releasing into the wild. However, they don't highlight this fact unless you watch the short documentary in a side room and then speak to the staff there. After walking round, it just seemed like a nice little bird zoo rearing highly endangered captive eagles and some other eagles, kites and owls, but a staff member in the film room highlighed the work behind the scenes rearing birds away from human contact so that they can be released. PLEASE HIGHLIGHT YOUR CONSERVATION EFFORTS MORE PROMINENTLY!"
"Aljess L"," ","March 5, 2018","Worthy cause","Kudos to the Philippine Eagle Center for its work to propagate the Philippine national bird. Went there on a weekday, not that busy--no guide available as well. A visitor's center with a multimedia presentation would have helped further the cause.  The place was a bit run down and could use a little sprucing up. It was sad to see the lone croc in its tiny enclosure and few other animals in captivity (deer, warthogs, etc.)   Not a fan of zoos but a visit and donation to the center is all for a worthy cause.  P.S. Bring bug repellent, the mosquitoes were relentless!"
"mrneli4evr"," ","March 5, 2018","Endangered Species in Davao","Different Endangered Animals you can see here in Philippine Eagle Center but was neglected. The place was not well taking cared of. Sad to look at those Animals in dirty cages, trees uncut or well maintained. Entrance fees are very high cost - not worth it for what you will see inside. You will not enjoy touring inside or seeing those animals but you will feel sad unlike other Parks (for Animals) we've been to. I hope you can do better than that. Was not impressed. "
"Mhina1021","Pasig, Philippines","March 3, 2018","Soaring with the Eagles","And I'm not talking about Ateneo but the real thing. I encourage you to take time to visit this place when you're in Davao. A little educational trip on the side wont hurt. As our national bird is critically endangered together with the other endemic species, we need to spread awareness. But aside from that it was really amazing seeing them in person and to see how majestic these creatures are. "
"Katrina L"," ","March 3, 2018","Majestic endangered eagles","The eagle center has many large cages for a few eagles. Some are not in cages, only tied to a post so visitors can come closer. They are really beautiful creatures. They have other animals there as well."
"leli G"," ","March 1, 2018","👍","I hope that they have a guided tour like in D’bone so that it can be interactive and not boring. 👍👍"
"doctorfoxtrot","Manila Philippines","February 17, 2018","Part of Itinerary But ..","It was a good part of the itinerary in Davao . But going there took quite a lot of time. More time travelling than the time actually spent there. Aside from the eagles held in captivity , there is also an owl and a crocodile. Since you are already there why not spend time buying souvenirs, trying the honey coated turon , and a photo op with a python. "
"Vegaztony"," "," "," "," "
"San Francisco, CA","San Francisco, CA","February 9, 2018","Cool Eagle Sanctuary","This was a very educational stop and I was awed by the number of Eagles at the Centre. This is a tour that you do on your own, and I was impressed with everything here. This is definitely a must-see on your journey."
"pixieserrano"," ","January 30, 2018","Wide array of species","There were more species here now than in the past few years, which is good because not only were there more animals and birds to see but it's inspiring to see more institutions adopting these creatures so they could survive. Would have been awesome if the whole place is kept tidy and the huts are maintained. overall, the experience is great especially for young children."
"Jay F","Davao City, Philippines","January 28, 2018","Only in Davao City","Best time to visit is during feeding time. That is around 8:30-9:00 am daily or 3:00-4:00 pm. There is an injured eagle that cant fly but can pose very well, make sure you have a selfie with it. Also, make sure that you put on mosquito repellant when you visit the center."
"Tor Erling M"," ","January 26, 2018","Nice place for picnic.","Nice place to see Eagles. And owls.walking around in fresh air and see birds or feed the fish. Or only have picnic with friends"
"looklikecris","Valenzuela, Philippines","January 24, 2018","A Sanctuary","A sanctuary for our national bird. But aside from eagle, we also had a close encounter with a huge crocodile, wild boars and monkeys. Compare from the other zoos I've been, animals here were almost close to their original habitat. But they are still in capture.   Entrance fee is 350 pesos for adults. It is pricey but we only think that it was a donation for this sanctuary because they really need our help for the conservation of our Philippine Eagles."
"travel_l_love","Vienna, Austria","January 21, 2018","Unacceptable conditions","It's one of the worst places for animals I have seen ever in my life. Although it is build with good intentions to help to sustain nature the cages for most of the beautiful creatures are far too small, the poor crocodile does not even have enough space to swim or dive. Only the massive KOJ Pond is ok. I felt such a pity for most of this beauties."
"Sally S","Tagaytay, Philippines","January 10, 2018","Zoo type","A lot of animals that was endangered can be found here at Philippine Eagle Center. Many eagles there was adopted by some large companies here in the Philippines to make sure they will grow well"
"Ailene E"," ","January 3, 2018","not properly maintained","some areas need to be renovated. comfort rooms are unsanitary. there is no available guide, there are some description on cages but some are hard to read. just pay the entrance fee go inside and tour yourself."
"PHExplorer"," "," "," "," "
"Manila, Philippines","Manila, Philippines","December 31, 2017","Absolutely a must","Do not expect a zoo. The center is simple, but with the small resources available to them (entrance fee is low) they did an excellent job. The birds are impressive to see, and there are many of them. The forest setting is wonderfully fresh and shady, and there are a few other animals that can be enjoyed. There is not too much explanation though, one aspect that could be improved. For young children it may easily get boring - you are watching birds after all. But for those who have never seen one of these elegant and endangered birds before, I recommend a visit. Plus the center definitely serves a good cause."
"Agnes Grace T"," ","December 21, 2017","Indeed, A Tourist Attraction","If you haven't seen any eagle ever since, you must visit this place and see the wonders of eagles and nature in this place."
"efrenr916","Taguig City, Philippines","December 14, 2017","A Filipino Treasure All must see","The Phil Eagle, the eternal symbol of Mindanao & Philippine Strength & Tenacity is conserved in this Centre. Witness the majesty of this apex predator, the true king of the skies. See eagles bred in captivity, the last and final chance to conserve a National...More"
"redgotsohigh","Manila, Philippines","November 26, 2017","A Must See!","This place has an entrance fee of P250 but its definitely worth it. We get to see eagles for the first time and man they're all huge. There are other animals as well as as owls,boar,monkeys and all but really the highlight are the fierce...More"
"Jim P"," ","November 26, 2017","No Longer Called the Monkey-eating Eagle","When I was at this place in 2001 they wouldn't let you within 100 feet of the eagles' cage for fear of scaring the pair away from breeding. By November, 2017, there were Philippine eagles in cages all over the place and you walk right...More"
"ymalih","Davao City, Philippines","November 16, 2017","Educational","Visiting the Philippine Eagle Center is getting back to the basics and be one with nature. One gets to learn more about the eagle and be amazed by its physical features as well as becoming fascinated of its key role in the environment."
"RaffySun61","Makati, Philippines","November 12, 2017","Must See If You Find Yourself In Davao","It was a nice but sad visit. Nice cause we got to see Pagasa the eagle and his other companions but sad cause the facility could use a lot of improvements. Everyone should donate. They need better and larger enclosures for the eagles and other...More"
"MrSnatch","Worcester, United Kingdom","November 11, 2017","Philippine Eagle Centre","I visited the centre based on reviews I read on trip advisor. Personally they were quite misleading. We travelled from Lanang having to use a bus which took approx 45 minutes then had.to grab a tricycle to the centre upon arrival there were locals selling...More"
"lionlamica"," "," "," "," "
"Florida","Florida","November 8, 2017","COOL PLACE, BIG RAPTORS","Went here today with my family and we had a great time looking at all the stuff from the very large croc to the phil eagles, owls, and other raptors, and the monkeys which were putting on quite a show for my family. If your...More"
"Raf O","Philippines","October 20, 2017","Amazing Eagle","The most beautiful eagle I've seen in my life..it's huge and looks different compare to other eagles. Tropical forest place is well maintained and preserved."
"Laney C"," ","October 17, 2017","Love it!","Visiting the Philippine Eagle Center was my reason of going to Davao. It was raining, but I can’t cancel going to the center cause I’m only staying in Davao for 3 days. I haven’t been to a sanctuary so I can’t compare. Going there alone...More"
"Valdis A","Kremenchuk, Ukraine","October 16, 2017","Huge Eagles! ","Nice Park for any age guests. Huge Eagles are living in a good condition and well-maintained place. Ask to take you a photo with eagle. Only in Davao!"
"mangomagnate","Davao City, Philippines","October 3, 2017","worth a look","Been there many times always enjoyable trip. Can get a tour guide if you want but not always needed."
"smartsmartin","Manila, Philippines","September 27, 2017","Hello Pagasa & other PH Eagles!","First time here despite visiting Davao countless of times. Great to have kids with you since they will be wide eyed upon seeing creatures they only see in books. For Filipino adults, just seeing Pagasa (the first PH eagle bred in captivity) perched atop a...More"
"Mon-Mon M"," ","September 24, 2017","Mighty Birds","Very informative tour. Sad that the birds are still not a lot in numbers. But happy that there is something being done about it."
"hallslim","Abu Dhabi, United Arab Emirates","September 13, 2017","Happy Weekend","It is a nature trip and a wonderful appreciation of this royal and marvelously amazing bird. I have been here many times and still in awe of this place and esp proud that we are blessed with this Majestic bird,the one and only Philippine Eagle....More"
"I_Am_Gretchen"," "," "," "," "
"Manila","Manila","September 6, 2017","The Philippine eagles are majestic","The Philippine eagles are majestic. We were in awe. Entrance is at 150 pesos. Wait for the eagles to open their wings or fly from 1 branch to another."
"Xplorer368"," ","August 16, 2017","Beautiful animals, please donate and make it better","I am amazed at the size of the birds... absolutely beautiful animals. The trainers were really educational and accommodating. The facility needs more help... you can help by donating the facility."
"rainbowwarrior126","General Santos, Philippines","August 14, 2017","One of a Kind!","I've been there twice. I went there for the third time with my family because i wanted to show to the kids how beautiful the place is and at the same time to allow them to learn more about our national pride. We are lucky...More"
"SimonDabbs","Melksham, United Kingdom","July 16, 2017","A really good insight into many types of eagle, and more.","Arriving at the centre, we were greeted warmly. To our amazement, we found we had our own personal guide, a young internee who told us she was a student of biology. She was excellent, and we had an entertaining and very well-informed tour of the...More"
"so g","davao city","July 13, 2017","Must visit!!","Educational and a wonderful way for children to appreciate Mother Nature and the web of life!! You can arrange for a tree planting and/or a donation for your party to leave imprints on foot paths!! allow an hour to see the short video presentation and...More"
"Jeremiah Anthon... R"," ","July 11, 2017","Very nice place to appreciate nature ","It's a cross between a nature park and a reserve... You'll really appreciate the work of the centre in keeping the eagles alive and well... You can see not only eagles but also other birds and animals so it's also like a zoo... A definite...More"
"LG C"," ","July 7, 2017","Beautiful Bird Sanctuary","From start to finish the Philippine Eagle Center was a journey worth taking. We planned the day around this activity because it seemed to have been about an hour drive from the hotel we were staying at in the city. We received a guided tour...More"
"Anne P"," ","July 5, 2017","Impressive Place","This place is really interesting and very inspiring knowing that there is a group/team who works really hard to take care of our eagle and other species. I hope that they will have more advertisement, tarpaulin, billboard in the city to encourage people to visit...More"
"radeo25"," "," "," "," "
"Davao City, Philippines","Davao City, Philippines","July 3, 2017","the national bird of Philippines","that time a visit i'm alone, i enjoyed watching the different eagles in cages, a i feel i'm in the jungle walking alone hearing some noise of birds, and you must visit if you are in davao city , it accessible to go this place...More"
"aoc827","Cebu City","June 26, 2017","Every Filipino should visit this place","It was definitely amazing to see how big the Philippine Eagle was and how wide is its wing span. There is even a small museum there that could be entertaining for history buffs.  Location of the conservatory is a bit far from the city but definitely a place to go to while in Davao."
"Don R"," ","June 22, 2017","Must see","Feels proud to see the largest eagle is found in the Philippines. They also have other types of large birds, a crocodile, philippine dear and a pond. I wish other large companies will support the center and further promote public awareness of the monkey eating eagle."
"Jerrilyn B"," ","June 10, 2017","A must Country Side Tour!","Philippine Eagle Nature Center (also known as Philippine Eagle Camp) is more or less an hour drive from the city proper. It's a bit far, so its hard to commute thru jeepneys, so we decided to ride on a taxi but because its a bit far.   It has different species of our national bird as well as other species of birds, mammals and reptiles. This center aims to educate visitors to conserve and save the endangered species like the our very on Philippine eagle.   This place was very peaceful you will just hear the chirping of birds, the rustling of leaves and the sound of wind blowing .   If you're in Davao you must visit this place, especially if you are a nature lover <3"
"Sol P","Davao City, Philippines","May 26, 2017","""Davao Vacation NOT complete- If Haven't seen How High Philippine Eagle Fly""","Philippine Eagle is now endangered specie and other than Durian Fruits, Philippine Eagle symbolizes Davao City. The venue is an hour ride from the City, best to travel with groups and with vehicle. There are many animals, souvenirs, fruits in the area. Bring your camera or cellphone, the ambiance is nature and you can take pictures with flying Philippine Eagle as your background, wear rubber shoes or sandals. Along Malagos street, you can also visit Malagos Garden Resort, Dairy Best etc.... fruits in Calinan are cheaper than buying in the city.  Enjoy your vacation with the Philippine Eagle."
"Floreces","Davao del Sur Province, Philippines","May 24, 2017","Educational Trip","Updated Fees: Php150/adult Php100/child  Free picture taking and viewing with the monkeys and eagles. There are also souvenirs and foods available outside at the Philippine Eagle Center.  Location: More than 1 hour away from Davao City center and more or less 5 minutes from Malagos Garden Resort."
"John L","Surigao del Norte Province, Philippines","May 23, 2017","Flying High With Philippines Eagle","This place is becoming well known but it's a bit of a distance outside of the city area of Davao. If you are with a couple of others you can share a taxi, the only really sensible way to get there. From a nature point of view, I always thought the Australian wedged tail eagle and the American bald eagle were the biggest. So, it was a pleasant surprise to know that these magnificent birds are at the top of the tree.  It's reasonably nicely set out without being too commercial, opting for natural surroundings. There is food available, resting places and a few other animal species there. Crocodiles, monkeys, darn big pythons, a goat or two and an animal of which I took a photo but have no idea what it is. There were a couple of sea eagles and koi fish pond. All adding to the ambience. Here's a tip - don't eat lunch there. There is a restaurant not too far away called Mountain Top Restaurant. Magnificent views while eating your meal and the scenery makes for great photos."
"Luke T","Gingoog City, Philippines","May 19, 2017","Wonderful place to visit beautiful Birds","These birds are so beautiful and so grand, I love watching them. And it is wonderful that the people are doing their best to insure that they will be around forever"
"Loreenstadie s"," ","May 14, 2017","beautiful place","This is must see as the Eagle is the largest eagle in the world this is located far from the town proper, it is about 40 mins to 1 hr travel by bus from the bus terminal to Calinan located beside Unionbank in San Pedro Extension. We were so happy to be so closed up with some eagles and had beautiful photos of them."
"John Q"," ","May 11, 2017","Visit to the Philippine Eagle","A visit to the sanctuary of the endangered Philippine Eagle should be encouraged for Filipinos and bird lovers. The Philippine Eagle, the country's national bird, is one of the biggest birds of prey in the world with a wingspan of over 7 feet. It is also endangered with an estimate of less than a thousand in the wild. It is endemic to the Philippines only. The Sanctuary provides care for eaglets and wounded eagles in order to allow them to survive in the wild eventually. There are also other specie of birds in the sanctuary including hawks and owls as well a fauna such as deer, monkeys and wild boar. A visit to the sanctuary involves a walk-through along jungle paths. The walk-through is quite primitive but provides a more natural ambience to the visit. Best to bring raingear because it often rains in the vicinity being at the foothills of the Mt Apo mountain range although the sanctuary provides umbrellas to visitors."
"Ram_B1969","Cebu City, Philippines","May 6, 2017","Go There For The Eagles","The place was quite far if you're based in the city proper so try to save ample time for the road travel, and consider possible traffic. If you go there with the primary intention of seeing the eagles, then it's worth the trip. You'll see them close. Although it's still a pitiful sight to see some of them without a cage but then tied up. Made me think which one's better for the bird, to be in a cage but not tied up or out of cage yet tied. The plants and trees are so healthy and naturally beautiful. Bring your camera, wear comfortable shoes and prepare to walk on unpaved or partially paved path. Wear comfortable cool clothes and bring your hanky or small towel for your sweat. Apply a mosquito repellent so you'll have a comfortable time. The park's not that big and you'll be done in an hour or less, but for me it was a short yet full and enjoyable experience."
"elviep2014"," ","May 5, 2017","Nice but quite far","We had to rent the hotel van to reach this area as it was far from the city centre. One cab driver was willing to take us there for a flat fee of Php 800 one way. The centre charges admission fee of Php 200 per person which discouraged some of the Filipino tourists who arrived at the same time as us. Quite an educational trip for us but somehow not worth the close to one hour trip to get there."
"Eve14_T","Makati, Philippines","May 4, 2017","Sad state of the Philippine Eagle","2nd time to visit but the first time was better than our last trip. Last time we saw Pag-Asa in his cage very clearly but this time we barely saw him. The cage was all covered up by trees not trimmed and crawling plants. The place was not maintained properly and there were lesser eagles. We were not able to visit the hatchery. But still the eagles are majestic "
"JanaK123","Penang Island, Malaysia","April 30, 2017","Amazing to see these eagles","We went at the same time that a group of youth (scouts?) were there so it was loud and perhaps we didn't get as much attention as we would have. The signs posted were informative. It was sad, though, to see eagles tethered. I hope that they were put in aviaries or something at some point so they didn't have to just stand on poles. There were some large aviaries so that was good to see. The Philippine Eagles are amazing creatures."
"reelrodcover","Montgomery, Texas","April 15, 2017","Great Fun plac","This is must see as the Eagle is the largest eagle in the world. Can take great pictures and have a grand time."
"Amil J"," ","April 14, 2017","unique experience","visited here on 2004 with family, it was a great experience. what's unique about it was the main attraction those monkey eating eagles they are amazingly huge. beautiful nature."
"TruthCalifornia"," "," "," "," "
"Boston, Massachusetts","Boston, Massachusetts","April 11, 2017","An excellent place to see this eagle up close","We were fortunate to see this eagle species in the wild. However, a scope view is not the same as an up close view. I don't like zoos but at this research centers, the eagles have a chance to breed and perhaps will be safe until the mountains will again support them."
"paulapple","england","March 24, 2017","Good spot","Nice place in cool gardens. Plenty of eagles and other birds in large cages. Research and education undertaken. Very interesting"
"HMix","Taguig City, Philippines","March 23, 2017","Eagle Center at Calinan Davao","A bit far but worth seeing these gorgeous animals. I noticed that they have fewer animals now compared to my previous visit in 2011/2012. You can get a cab (contrata or agreement style). They can wait for you for 1-2 hours. There are eateries on...More"
"Princess M"," ","March 22, 2017","Family Bonding","Philippine Eagle Center houses several eagle who have been injured, captured as a pet and was rescued (its illegal to have them as pet etc because they are endangered and endemic in our country) there's also a big cage separated in the middle where male...More"
"Majewel1987","Makati, Philippines","March 16, 2017","Philippine's eagle","The place is not well maintained. A lot of mosquitoes. I still want to return to this place since the fees will help feed the birds."
"Olga P","Vancouver, Canada","March 15, 2017","Not to miss this visit!","Excellent and surprising find in our travel to Davao- the centre had amazing collection of plants and eagles. We were so happy to be so closed up with some eagles and had beautiful photos of them. We are impressed with the cleanliness and lush garden...More"
"rej26qmd","Metro Manila, Philippines","March 8, 2017","Must-Visit in Davao","It is located in Malagos. Entrance fee is 5 pesos at the park, where the Philippine Eagle Center is located, and 150 pesos at the center itself. It is a bird sanctuary where you can also find other birds. The place encourages disinfection before you...More"
"Märijoice Angel... G"," ","March 4, 2017","Eco-friendly, Refreshing Tour with a Romantic Twist","The trip here is enjoyable when you commute like locals do - jeepney then motorcycle ride ;) Boyfie and I enjoyed watching and taking photos of the august eagles and the other animals taken care of in here. They are the living mementos that this...More"
"YMCML"," "," "," "," "
"Manila, Philippines","Manila, Philippines","March 1, 2017","Majestic Philippine Eagles","Metered taxi from the airport costed me almost 600 pesos one way on a light to moderate traffic. It's quite far from the city proper. Other options is to commute but it will take you a little more time to get there. Seeing the Philippine...More"
"masoraidar","Cebu City, Philippines","February 25, 2017","Nice","Awesome place to visit! The uncertain future of the Philippine Eagle should remind of how many species disappear from the surface of the Earth, not only through evolution."
"tom1941","Philippines","February 15, 2017","Nice drive if you have extra time","I enjoyed the drive from Davao to the park. Their were not really a lot of birds like at the park in Singapore. A cage of monkeys. It was clean and I did enjoy the day. There are a lot of vendor stands and I...More"
"bhsceo","Davao City, Philippines","February 15, 2017","Best Eagle Park","Very much attractive & worth visiting Eagles viewing amazing.Beautiful garden & huts around. Like shopping era and cheap products."
