"User","Location","Date of Review","Review Title","Review"
"KlausDORING","Davao City","December 24, 2014","Another step to Mother Nature","Learning abut our environment and the important future of our beloved Mother Nature means to say: Visit the Philippine Eagle Center in Malagos, Calinan, Davao City, Mindanao. Learn about the Philippine eagles, love them - and support them and this awesome and unique institution."
"glow143"," Davao City, Philippines","December 21, 2014","Love the Phil. eagle","Learn to love our environment because it is our social obligation. We are not consistent with it. We always have the culture of Ningas Cogon. Be responsible as a traveler."
"allen g"," ","December 18, 2014","Rare with nature","This place is in the middle of the forest a perfect place for our very own philippine eagle... There are only few of them left in the world... So dont miss the chance of seeing one in your lifetime... Never visit davao without going to see the philippine eagle centre"
"Jackie C"," ","December 16, 2014","Eagles up close","Davao is known for being the habitat of the rare Philippine Eagle and if you can't see them in the wild, you can always go here, the park is well maintained and is usually being visited by young children :)"
"funhuntr"," "," "," "," "
"Manila","Manila","December 9, 2014","Worth the visit for 1st timers","See actual eagles! If you haven't seen one before, this is the place to go to, if you're Filipino and haven't seen our national bird, well this is a must. Tip : get a guide, it's not too expensive (at least donate a good amount, say Php300 to 500 or more especially for big groups ... they're volunteers and worth every cent). The entrance fee (Php100) is a small price to pay to keep the grounds semi decent and to keep those birds fed. A place to visit at least once in Davao."
"TheUglyDog","Orlando, Florida","November 25, 2014","Those are some BIG Birds!!","This is a nice eco-park that is helping to preserve the Philippine Eagles. You can get quite close and really appreciate the size and magesty of these spectacular animals."
"Jeff Z","Davao City, Philippines","November 12, 2014","My childhood memories revisited","Ahh... I still remember back then when I first visited here, it was on a school trip during elementary. The first thing that I wanted to see here was the Philippine Eagle itself. I only manage to caught a glimpse of it since we had...More"
"Nomad_Charles","Variable","November 12, 2014","The birds are fantastic","This is a bit run down but in a nice tropical jungle sort of way. The birds are fantastic and well worth the visit. The whole setting is shady and very beautiful and relaxing. To get there by public transport: - take a jeepneye from...More"
"lloydangpogi3","Manila, Philippines","November 3, 2014","american bald eagle is over rated....needs funding for the strongest bird in the world...critically endangered. HELP ...","i find it amazing to see the national bird of our country. its so huge. . . .very territorial . . . but they need funding to make it a great park. . . . it is critically endangered . . . funding is low...More"
"Fourth S"," ","October 28, 2014","A must see! :)","I took my kid for a tour to get him acquainted with these magnificent creatures. He likes it so much we made 3 trips to the cages that single visit! Reading the provided information about the eagles is amazing, i never knew then that eagle...More"
"FilipinoAdventurer"," ","October 13, 2014","Endangered Philippine Eagle","Whenever I visit Davao which is one of my favorite cities here in the Philippines, one of my sure stops is the Philippine Eagle Center. I been to a lot of countries, I saw species of eagles prevalent to their area like when I went...More"
"iamsherri","Cagayan de Oro, Philippines","September 24, 2014","A great experience","I was with my father when i first visited the place and it was really a great experience to see the Philippine Eagle. The place was nice but not really that perfect coz its obviously not well-maintained. I love the huge trees and different plants...More"
"TravelBug1469"," "," "," "," "
"Manila, Philippines","Manila, Philippines","September 22, 2014","Fly High Philippine Eagle","Good there is a foundation taking care of the endangered Philippine eagle. The Philippine Eagle Center needs more visitors and / or donors to come to Malagos. Every contribution you make, however small, will come a long way for preservation and propagation of the King...More"
"Kuki F"," ","September 17, 2014","amazing","Its amazing to see the king of birds. When they fly they are really huge. The place is not that clean."
"Darundoy18","Quezon City, Quezon City, Philippines","September 13, 2014","Pray to the Birds of Prey","I liked the huge space of the park and the chance to be with nature. The care takers are nice people and let you have a photo op with some of the birds there. Too bad there aren't any tour guides to give us some...More"
"raymmiconmapper","Bacolod, Philippines","September 13, 2014","a must see in Davao","very educational & close encounter with the Philippine eagle & other birds Pag-asa.Mindanao, Rose etc. etc.the caretaker Mr.Poroy showcases the bird's talent & antics"
"igmegalingan","Quezon City, Philippines","September 13, 2014","Hope the Eagles are still benefiting from this place","There is something seriously wrong with big birds in cages especially considering the power of their size and the nature of birds to fly in big directions. I hope this place is doing what it is meant to do which is to help these big...More"
"davao_dude","Davao City","September 7, 2014","Educational","The center houses birds in captivity. Some of the eagles were rescued then rehabilitated before they were released in the wild. It is also successful in breeding the eagles while in captivity."
"Aileen T","Caloocan, Philippines","September 6, 2014","Selfie Mindanao","I thought the place will be boring, we are wrong. It's a big WOW. The eagles have different tricks and we all amazed. And the best part we have a selfie picture with the eagle named Mindanao. We are shock that the caretaker told us...More"
"terry_pagunsan"," ","September 3, 2014","Philippine Eagle Center in Davao City","We had a lengthy drive in going to the place from the City proper. The place is damp as it rained the day before. Have seen small, medium and large size eagles. We saw monkey also."
"Ma S"," ","September 3, 2014","Eagle Centre","We took the kids here. We were amazed with the birds there. Saw my first Sea Eagle! I never thought it was that big. It was clean and well maintained for a rainforest type place. Bought some really cool native handicrafts. There were a group...More"
"blessie","New Zealand","August 29, 2014","Name says it all","The Philippine Eagle is one of the most magnificent birds I have ever seen. I hope that the centre continues the good work that they do in ensuring that these creatures are protected and hopefully increase their number. The place is one of the ""must visit"" when you're in Davao. "
"cpepino","Mandaue, Philippines","August 26, 2014","Philippine Eagle Center","The Philippine Eagle Center is actually beautiful. Lots of trees... cool shade, but its area was just small. There are few birds being taken cared of. And there are very few varieties of birds to see. But I am not an expert, so maybe I am not quite right in my opinions.   The conservation efforts are commendable but I think the center needs more funding to really achieve their mission. I hope the center will continue to strive to keep the place, maybe expand it a little bit more... keep it as it is - clean. Although I am not happy to see these magnificent birds in cages or leashes, but they are worth visiting so that an awareness can be created for the kids and the next generation. The awareness to preserve and protect our habitat and all those living in it."
"Lynard M","Las Pinas, Philippines","August 24, 2014","superb experience","it was my first time to see eagles, although i have seen one somewhere else but not close enough. if you want to consider visiting the place, bring along with you mosquito repellents."
"AkoBato","Singapore, Singapore","August 20, 2014","mindanao is the star of the centre","i've always wanted to see the philippine eagle but my expectations werent that high...but going to the place and actually seeing one, and especially having an eagle like mindanao is just really amazing.  this bird can do selfie with you and has tricks up his sleeves.  there is an entrance at the gate for 5PHP, which we dont know what for as there is another entrance when you actually go up the centre (100PHP). but either way its just a small amount to make sure these birds are protected.  the foot path of the centre is also interesting as it has stones with names on it (probably those who donated) and its fun reading it and seeing how many people from all over the world have been to the centre.  its a must place to go when you are in davao.  taxi ride would cost 1000PHP round trip, but you can ask the taxt driver to give it to you at 2500 to include trips to other landmarks"
"SandySanti","Manila, Philippines","August 6, 2014","great eagle sanctuary","amazing place to visit. about 40 minutes from town. its nice to see the conservation efforts for the philippine eagle"
"Liezel G","Davao del Sur Province, Philippines","August 3, 2014","Nice for fieldtrip","This is far away from downtown. But for fieldtrip this is worth a visit. It's nice to know that the place and animals is still preserved. It's very relaxing and my son enjoyed the animals. :)"
"Iza_Obejera","Manila, Philippines","July 29, 2014","Protector","I liked that the place is doing their job protecting the Philippine Eagles who are endangered. As well as the other birds."
"geofhaar"," ","July 28, 2014","Rather small","It's a nice place to spend a halfday, but quite far from Davao centre and rather small. Aside the philippine eagle they have also other eagles, owls, monkeys and 1 crocodile which in my opinion should be transfrered to a bigger place."
"JuanangGala"," ","June 23, 2014","Nice stroll","This centre is about 1-1.5 hrs from Davao City. If you have the time, it nice to go.   Get a guide. The facts and trivia they give out make the stroll more interesting. The guides are students and volunteers, keep this in mind when you tip."
"Steve S","Toronto, Canada","June 22, 2014","Eagle","We were with 4 kids and 3 adults and all got a photo taken with an Eagle from the caretaker.Quiet and know one around on a Saturday too."
"JEmmanuelLasPinas","Las Pinas","June 21, 2014","A unique place to visit","Schedule enough time to get there and once you get there, do not rush. spend time learning about the Philippine eagle and its habitat and visit the raptors that are housed at the centre."
"itoy_MNL","Manila, Philippines","June 20, 2014","Its nice to see the Philippine Eagle... that's it...","We went to Davao for a vacation and planned to include the PEC on our last day itinerary.  It is easily accessible from downtown Davao. Just go to the Annil Bus Terminal located at the corner of San Pedro and Quirino Streets. The fare for air-conditioned bus from Davao City to Calinan is 45 pesos. Upon arriving at the Calinan Bus Terminal, there are tricycles waiting which goes directly to the Philippine Eagle Center (10 pesos fare per person if sharing the ride with other passengers). The total travel time is about an hour, shorter time if you travel by car.  We checked the website of PEC prior to our visit, where it is indicated that there are tour guides who will assist you for free. Upon paying for our entrance tickets, we saw a group of tour guides sitting at a table merrily chatting and ignoring us even if its obvious that we were there as local tourists. Then a group of foreigners arrived, and they eagerly approached and volunteered to tour the foreign guests around. ITS A COMPLETE SHAME THAT THESE TOUR GUIDES ARE DISCRIMINATING FELLOW FILIPINOS. -calling the attention of PEC Management.  We had no choice but to wander around on our own. The place is filled with lush vegetation, more like a jungle-type of atmosphere where you will see huge trees and wild flowers blooming. We had a glimpse of different bird and animal species aside from the Philippine Eagle. Its too bad that the famous eagle named ""Pag-asa"" is in a huge cage located on the upper part of the center and is currently not accessible due to some maintenance on-going.   Be careful while walking around because there are small insects which flies directly to your eyes, I got about four of them and my companion had three stuck in our eyes. Carefully pick them out as you might end up having pieces of these insects in your eyes if you just scratch your eyes with the insect in it. Better to wear your eyeglasses or shades or perhaps swimming goggles for kids ;-) it looks dumb but its better than having your visit ruined by insects stucked in your eyes.  There's a free toilet located near the ticket counter, along with the PEC souvenir shop and snack center.   Overall, the Philippine Eagle Center is worth a visit to see the Philippine's famous eagle.   IMPORTANT REMINDER: There's a man selling ""driftwood"" carving of the holy family outside the Center. It looks good and he explained to us that its worth the 1,200 pesos price tag because its an authentic wood carving from the nearby penal colony. We haggled for 600 pesos but ended up paying 700 pesos. Upon returning to Manila, we found out that the outer frame is genuine driftwood, but the sculpture itself is just molded from plaster of paris. Another shameful act of dishonesty from fellow Filipinos. :-(  The gift shops lined up outside the PEC sells more expensive goods. Better save your money and proceed to Aldevinco Shopping Center in downtown Davao. I bought batik shawls there for 180 pesos and you can get better design and quality from Aldevinco for as low as 150 pesos."
"Anna L","Mandaluyong, Philippines","June 17, 2014","the tour was great but the system is poor","it was a great tour but i cant forget the argument with other visitors. i understand they where arguing about the whose to go first or whose in the line or not.. sad but sometimes its a fact."
"Joel D","Manila, Philippines","June 15, 2014","The Eagle conservation Center in the Philippines","I rate the place very good and really made sure i visit because I am a supporter of any conservation effort specially the Philippine Eagle. The place is dated and definitely needs good maintenance and upkeep. It was may first time to see various eagles up close. The place has good vegetation but a little improvement in terms of cleanliness, maintenance and discipline will make the place more attractive."
"AprilCamias","San Pedro, Philippines","June 11, 2014","Time to be Amazed by the Nature","Nature will love you and you will love the nature. I was amazed by the nature's wonders. It seems that you are in the middle of a vast, quiet forest with lots of endangered species. It was like a Bug's Life or Narnia. It was a definite place to go to when you are in Davao :)"
"promdicitygirl"," ","June 3, 2014","must-see","There are a lot of different birds and animals in the Eagle Center. Of course, you will see the Philippine Eagle but you will also enjoy seeing the different birds native to Mindanao."
"Screaming_Pen","Davao City, Philippines","May 27, 2014","A good spot to enjoy nature","The Philippine Eagle Centre is one of the best tourist spots in Davao City even before when I was young. It houses the great Monkey-eating eagle which is arguably one of the largest eagles in the world.   However, there are some noticeable changes that needs immediate attention for further improvement of the area. 1. the cleanliness - the area must be kept clean at all times. Since most of the tourists there are nature-tripping, they really cannot appreciate litter. Garbage bins were full and there were some areas were very untidy.  2. price increase - the adult / child entrance fees of 100 / 50 would in my opinion, discourage local tourists to visit because it is somewhat costly. However, if the fee would benefit the animals in the centre then I may agree to the agree to the price increase (effective June 4, 2014) 3. predicament of the animals - As I have observed some cages of the animals lacked maintenance like cleaning, and pruning the weeds that engulfed the big cages. Maybe they should at least clean it once in a while.  If these three would be addressed, I think the centre will still be a great tourist icon in Davao City for many years to come. PLEASE DO ADDRESS THE ISSUES I HAVE RAISE. Not for me, but for the benefit of the next generation.   Tip: Look for handlers around the center that would provide opportunities for you to have a closer picture or even hold the eagles."
"RuthBB76","Manila, Philippines","May 18, 2014","Must visit","Must visit when in Davao. Nice and pleasant nature trip among century old trees and thick foliage. The eagles are awesome. The guides are very good in explaining the why and wherefores of Pag-asa and the other eagles."
"GraceSanJuan","San Juan","May 15, 2014","Haribon really must see","We spent almost P1,000 for taxi going to Malagos Park and going back to D'Leonor Adventure Park. Took almost 45 minutes by taxi. I wish Davao city Tourism do something about a shuttle to transport tourists to this destination, so we wont be at the mercy of Cabs."
"Blessie Y"," ","May 3, 2014","Small but not boring","We went there just last month and we're glad to know that the sanctuary is improving. A volunteer for the Philippine Eagle welcomed us and made us comfortable to the place, he explains everything about the eagles-their behaviors and their way of living (it was a bit entertaining),truly educational. The place is a bit small because they're just occupying a small portion of an acre. Attractions include: eagles, monkeys, an alligator, fish pond, a small museum. Entrance fee is 50php, and an additional 5php for the watershed.   Oh, don't forget to give a tip for the volunteers, they're extremely kind and accomodating. On your way out, you will find locals with large pythons for picture taking. You just have to pay 20php per person, unlimited pictures. The pythons are a bit scary because they're big but they're totally calm and friendly, I guess.   Enjoy the davao heritage. Visit Philippine eagle. "
"bel3ms","Manila, Philippines","April 20, 2014","the eagles are worth it","the eagles are worth it! go here first and then ask the taxi driver to bring you to malagos garden resort. buy malagos dark chocolate bar and bring home with you. its the best!"
"Glentoy","Davao City, Philippines","April 17, 2014","A must-see attraction in Davao City","It is quite far from the city but if you want to see the Philippine Eagle, you should visit this center. It is our national bird after all. Entrance fee is only P50 for adults and P30 for children below 18 years old."
"lifegifts","Davao City, Philippines","April 16, 2014","your visit helps conserve the eagles","Its a place to see the endangered Philippine Eagles. Its both a conservation park and breeding place. Visit to help conserve the eagles and enjoy the silent moments with the birds and trees. I suggest that tourists talk with the employees to learn more of the great work they are into."
"Carlos D"," "," "," "," "
"Davao City, Philippines","Davao City, Philippines","April 16, 2014","World Class","The science behind this captive breeding facility is definitely at par with similar Centres around the world. The Education Centre & live displays do justice to this Eagle which is the tallest in the world. The collection of other tropical raptors & other species is very interesting."
"Kaye214","Davao","March 27, 2014","A bit far but one of a kind trip","It's about an hour's ride from the city but when you get there you'll have fun especially if you're with kids. Near the entrance there's a guy who has a pet snake and he will let you hold it and pose for a photo for any amount you want to give. The entrance to the park is cheap and the place is pretty big with some decade-olds trees. It's not in tip top shape but there are quite a number of eagles (the reason you're going here after all), most in cages and about a couple out in the open (eagles who can't fly anymore). If you have time or enjoy nature/animals, it's worth a visit."
"donzero","manila","March 24, 2014","a great learning experience","a great learning experience and a knowledgeable and friendly guide is what this place boasts of. indeed worth the trip!"
"Dibyne","Davao City, Philippines","March 20, 2014","Nature tripping thats effortless","Its the kind of nature tripping without exerting much effort. also, you get to see the monkey-eating eagle which Davao is famous about."
"Scottie B","Valencia City, Philippines","March 9, 2014","Just an average attraction","It is just an average attraction, they have have more living monkeys than their living philippine eagle."
"Minette T"," ","March 8, 2014","Close-to-nature experience!","My aviary experience in the Malagos Phil. Eagle Sanctuary was definitely a one-hella experience.Kids were in awe of the different species of birds & eagles upclose and personal. It's like u are wandering inside a forest, a protected wildlife, with so much of God's wonderful creations to see! Filmviewing for interested guests is also welcome for addt'l knowledge. Stuffed dead eagles are well preserved inside the glass cabinets. So much to see w/ so li'l time, will absolutely go back to appreciate more of natures' wonders."
"agramsagitro","Mandaluyong, Philippines","March 4, 2014","Educational Visit","We had a very good guide around the center so we learned a lot about the Philippines Eagle, such an amazing bird!!!! Doesn't take long to visit the center making an easy stop in one's itinerary."
"Jeremy N","Dover, Delaware","February 26, 2014","Great day tour stop","Great place to visit in Davao especially if you are a bird and nature lover. Very well maintained and the animals and birds are well taken care of. The staff is very knowledgeable and friendly."
"Asiatique07"," "," "," "," "
"Manila, Philippines","Manila, Philippines","February 23, 2014","Informative but needs improvement","As someone who advocates life, I am thankful for this institution's endeavor to protect the Philippine eagle. However, as someone who's been to other aviaries, I would say that this place needs a lot of improvement. Well, considering the cheap entrance fee, I can see why the state of the park is like so, but if it's to protect this endangered species and to promote awareness about it, I would be willing to pay more just to uplift this aviary.  In terms of the flora, it is very abundant, and it also includes some other fauna that is endemic in the country. I also like how there are informative boards and trivia about different sub- species of eagles. I like how they are focused more on what's endemic in the country as well.  There are things that need improvement. For one, the museum's displays are obviously not taken care of properly. The stuffed animals have collected dust and some have been stored away probably because the environment in the museum is not controlled. Another thing is that the birds are chained. I know that this is to prevent the people from getting hurt, but another thing that can be done I think is to put a glass walkway or a cage walkway for people so that they can observe the birds fly freely. Some parts of the aviary specifically the wires are also not maintained. From the people I was with who've been there before, they also noted a considerably fewer number of birds. I think there is lack of funding in terms of breeding these birds and probably the lack of zookeepers.  To end, the place is worth a visit to get to know these endemic eagles more. It will help them raise funds to protect these animals as well as to repopulate them. However, don't expect an ideal aviary seeing as it needs further improvement. There are stalls for donations though, so hopefully many will be able to help."
"trainerstone","Philippines via Chicago","February 17, 2014","They try hard","A basic aviary and breeding reserve for the endangered Philipine eagle. It is close to an hour outside of the ,main city, but worth it to see these magestic birds in large cages. The goal is to repopulate as much as they can. Worth the trip. "
"iluvursmiles","Quezon City, Philippines","February 11, 2014","Birds in their cages","This is a nice place to visit when you are in Davao because they have our National Bird. The sad thing is, most of the birds are in their cages so you can't have a good picture with you and the bird together. We came here before we went to Malagos Garden Resort so we had very limited time to stroll around and we were trying to catch the 1030am bird show at Malagos.   I was trying to look for their contact number to inquire but I just couldn't find it and couldn't get through. I hope they can have a hotline so people can inquire. From what I saw you can take pictures with the eagle up close. So it would be helpful if they had time schedule of when they would bring out the eagles so you can take pictures with them. Sadly, they brought out 3 birds but their show / program was in conflict with the 1030am bird show in Malagos."
"ManilaGingersnap","Manila","January 31, 2014","Must-go","You will learn a lot here so make sure you go. There were buses of school kids when we got there and their field trip was thankfully over by then. So don't go too early as the area where you are toured is not very big. "
